post_id	date	message	num_likes	num_angry	num_shares
1216504185136925_1700581250062547	2018-06-24T17:47:30+0000	"se voce ainda nao assistiu, clique aqui www.portalcirogomes.com.br/noticias/ciro-participa-do-programa-roda-viva. se voce ja viu, compartilhe!"	1076	2	97
1216504185136925_1697721693681836	2018-06-24T13:00:01+0000	"o lucas, jornalista de sao paulo, quer saber quais as propostas do ciro para reduzir a desigualdade social entre as pessoas no brasil."	536	1	103
1216504185136925_1698640763589929	2018-06-23T12:24:25+0000	"faca parte desse time que quer transformar o brasil pelo caminho do trabalho e da dignidade. toda contribuicao, por menor que seja, e muito importante para nos. acesse www.portalcirogomes.com.br/faca-sua-doacao"	445	0	41
1216504185136925_1697352447052094	2018-06-22T17:05:42+0000	"acesse: www.portalcirogomes.com.br"	585	1	36
1216504185136925_1695785283875477	2018-06-21T17:59:35+0000	"ciro #aovivo em pelotas no instituto federal sul rio grandense - ifsul."	498	1	60
1216504185136925_1695359227251416	2018-06-21T13:13:35+0000	"acompanhe ciro #aovivo na camara municipal de sao borja - rs, em sessao solene em homenagem aos 14 anos do falecimento do governador leonel brizola."	622	0	178
1216504185136925_1694517707335568	2018-06-21T00:06:23+0000	"acompanhe ciro #aovivo no centro de tradicoes gauchas tropilha crioula, falando sobre a atual conjuntura economica do brasil."	1221	24	407
1216504185136925_1694451134008892	2018-06-20T23:23:13+0000	"acompanhe ciro #aovivo no centro de tradicoes gauchas tropilha crioula, falando sobre a atual conjuntura economica do brasil."	582	1	152
1216504185136925_1694338167353522	2018-06-20T21:23:47+0000	"chegamos em sao borja - rs e fomos muito bem recebidos pela juventude socialista do pdt, pelo amigo wolmar castilhos e pelo deputado federal pompeo de mattos.  siga o ciro pelo rio grande do sul: www.portalcirogomes.com.br"	634	3	60
1216504185136925_1694279980692674	2018-06-20T20:35:28+0000	"acompanhe aqui: www.portalcirogomes.com.br"	400	2	20
1216504185136925_1692924937494845	2018-06-20T11:30:00+0000	"ciro vai fazer no brasil o que ja fez como prefeito e governador: repartir o poder com as mulheres. seu objetivo e ter 50% dos ministerios ocupados por elas."	3227	8	1297
1216504185136925_1689870421133630	2018-06-17T20:00:50+0000	"ciro foi o convidado do jornal da manha, na radio jovem pan, nesta segunda-feira. confira como foi: https://goo.gl/sjoaym"	1021	3	269
1216504185136925_1688527274601278	2018-06-17T13:00:01+0000	"ciro gomes e preparado. foi eleito governador do ceara aos 32 anos, o mais jovem da historia do brasil."	2136	9	230
1216504185136925_1688503221270350	2018-06-17T11:00:00+0000	"como enfrentar o problema da saude no brasil? essa foi a pergunta do gustavo amorim, do parana, para o ciro durante o roda viva e e tambem a duvida de grande parte da populacao. veja a resposta."	599	4	154
1216504185136925_1688477261272946	2018-06-16T23:00:00+0000	"a farra do dolar. o que esta acontecendo com o cambio, ciro ja denunciava dois anos atras."	1661	11	1394
1216504185136925_1688437797943559	2018-06-16T19:46:15+0000	"acompanhe aqui: www.portalcirogomes.com.br"	401	2	15
1216504185136925_1687173914736614	2018-06-15T22:24:01+0000	"este ano, a lei eleitoral permite que pessoas fisicas facam doacoes para as campanhas atraves da internet, com toda fiscalizacao do tse (tribunal superior eleitoral). faca sua doacao aqui: www.portalcirogomes.com.br/faca-sua-doacao."	437	4	48
1216504185136925_1686813651439307	2018-06-15T16:16:29+0000	"ciro participa #aovivo do conexao empresarial, em tiradentes (mg)."	774	4	247
1216504185136925_1685843048203034	2018-06-15T00:42:05+0000	"torcer pelo brasil? sempre. vai brasil!  rumo ao hexa! gool!"	3890	20	2183
1216504185136925_1684277068359632	2018-06-13T23:25:48+0000	"acompanhe ciro #aovivo em palestra para os alunos da furb em blumenau - sc."	1271	42	651
1216504185136925_1684196051701067	2018-06-13T22:01:42+0000	"veja como foi a entrevista de caetano veloso com ciro para o canal do midia ninja no youtube. acesse: https://goo.gl/owqdny #caetanoeciro"	1548	1	212
1216504185136925_1683738181746854	2018-06-13T15:28:32+0000	"acompanhe ciro #aovivo na apresentacao de ideias dos presidenciaveis, direto do congresso de prefeitos em santa catarina."	1252	12	600
1216504185136925_1683739188413420	2018-06-13T15:23:19+0000	"tenho a honra de poder estar ao lado de carlos lupi, meu amigo e presidente nacional do pdt, na luta por um brasil mais justo. amigo pessoal de leonel brizola, ministro do trabalho quando foram criados cerca de 10 milhoes de empregos no pais, lupi tem grandes servicos prestados a nacao e carrega a bandeira do trabalhismo com muita garra e responsabilidade.  infelizmente, nesta luta que travamos juntos contra a corrupcao, contra o capital especulativo, contra a entrega do nosso pais ao banditismo, sofreremos muitos ataques de quem nao quer um brasil melhor e com maior distribuicao de renda.  estamos juntos e vamos lutar ate o fim pelo brasil!"	986	2	101
1216504185136925_1682680888519250	2018-06-12T20:38:29+0000	"para doar, acesse: www.portalcirogomes.com.br/faca-sua-doacao. fazendo a sua doacao voce estara contribuindo com as nossas ideias e propostas independentes para mudar o brasil. toda contribuicao, por menor que seja, e importante para nos."	769	0	97
1216504185136925_1682184598568879	2018-06-12T11:58:26+0000	"na noite desta segunda, participei em niteroi (rj) do lancamento da pre-candidatura do deputado federal chico d'angelo, um companheiro de muito valor. e fundamental que procuremos eleger boas deputadas e bons deputados para a camara federal."	562	1	24
1216504185136925_1681703625283643	2018-06-11T22:37:11+0000	"acesse: www.portalcirogomes.com.br"	418	2	56
1216504185136925_1681102332010439	2018-06-11T12:40:38+0000	"editorial da folha de s. paulo confirma a tragedia que se abateu sobre a geracao de empregos no brasil, especialmente entre os jovens. so com um projeto nacional de desenvolvimento que priorize a retomada da industrializacao e um investimento forte na educacao publica de qualidade e que vamos conseguir superar a triste realidade de milhoes de jovens hoje sem estudo, sem qualificacao para o trabalho, sem emprego e sem visao de um futuro melhor. vamos virar esse jogo, brasil!"	741	2	109
1216504185136925_1678657265588279	2018-06-09T16:13:02+0000	"esta manha me encontrei em buenos aires com margarita stobizer e diversos dirigentes da centro-esquerda argentina. brasil e argentina enfrentam problemas semelhantes em diversas areas e as solucoes podem ser encontradas em uma parceria verdadeira que pode contribuir para o desenvolvimento de toda a regiao."	730	1	69
1216504185136925_1677704179016921	2018-06-09T13:00:01+0000	"\"vou ter que trabalhar ate os 80 anos pra me aposentar?'', essa duvida e do carlos roberto e de muita gente. ciro responde. #pergunteaociro"	698	0	265
1216504185136925_1677451975708808	2018-06-09T00:39:14+0000	"ajude a mudar o brasil. venha com a gente! acesse: www.portalcirogomes.com.br/faca-sua-doacao"	2319	7	1361
1216504185136925_1677350599052279	2018-06-08T15:02:57+0000	"participei nesta manha, em buenos aires (argentina), de encontro com empresarios argentinos do setor agropecuario representados pelo consorcio regional de experimentacion agricola (crea) e pelo grupo de paises productores del sur (gps latin america).  pudemos debater o delicado momento economico de nossa regiao e a importancia do mercosul para as nossas relacoes comerciais, politicas e de desenvolvimento.  assim como no brasil, o setor e muito importante para toda a regiao. as relacoes entre os nossos paises deve ser proxima, de confianca e de cooperacao."	835	0	135
1216504185136925_1676433902477282	2018-06-07T16:37:29+0000	"saiba mais, acesse: www.portalcirogomes.com.br"	1521	1	200
1216504185136925_1675365359250803	2018-06-07T12:43:52+0000	"desde cedo, ciro acumula experiencia e preparo para servir ao brasil."	2168	1	1028
1216504185136925_1675578875896118	2018-06-06T20:25:12+0000	"participei hoje, em brasilia, de almoco com embaixadores da uniao europeia. pude expor o projeto nacional de desenvolvimento que defendo para o brasil e conversamos tambem sobre as relacoes do brasil com os paises europeus. temos muito a cooperar com todas as nacoes."	2242	0	482
1216504185136925_1675562255897780	2018-06-06T19:59:17+0000	"''meu patrao e o povo brasileiro''. para saber mais, acesse: https://goo.gl/8ok482"	630	1	81
1216504185136925_1675466105907395	2018-06-06T17:54:02+0000	"acompanhe o ciro #aovivo a partir das 15h pelo site: www.correiobraziliense.com.br/correioentrevista"	770	2	44
1216504185136925_1675254862595186	2018-06-06T13:41:13+0000	"o que podemos fazer pela educacao do brasil? confira algumas de nossas ideias #cironorodaviva"	628	1	217
1216504185136925_1674078869379452	2018-06-05T12:15:58+0000	"hoje, no dia mundial do meio ambiente, reforco aqui meu compromisso em promover o desenvolvimento do brasil preservando nosso imenso e belo patrimonio natural. #diamundialdomeioambiente"	1185	2	162
1216504185136925_1670165463104126	2018-06-02T12:00:00+0000	"carinhoso, musica de pixinguinha, e uma das preferidas do ciro. ao final do roda viva, ciro respondeu outras curiosidades sobre ele. assista! #cironorodaviva"	2076	5	356
1216504185136925_1670176626436343	2018-06-01T18:13:09+0000	"petrobras: nao basta apenas demitir o pedro parente. tem que mudar a politica de precos."	6327	26	8083
1216504185136925_1668308216623184	2018-06-01T12:00:00+0000	"a corrupcao na politica preocupa o wesley e ele quer saber o que o ciro tem dizer sobre o assunto. #pergunteaociro"	765	0	195
1216504185136925_1668365436617462	2018-05-31T11:30:01+0000	"ciro comandou a economia brasileira em 1994 e impediu os ataques especulativos que ameacavam o plano real."	2396	5	1139
1216504185136925_1668112613309411	2018-05-30T17:41:51+0000	"vamos debater energia alternativa! acompanhe o ciro #aovivo no evento sobre biocombustiveis no brasil."	833	1	178
1216504185136925_1668081823312490	2018-05-30T17:14:24+0000	"vamos debater energia alternativa! acompanhe o ciro #aovivo no evento sobre biocombustiveis no brasil."	676	2	250
1216504185136925_1667145526739453	2018-05-29T18:05:33+0000	"perdeu o roda viva? assista o programa completo aqui  #cironorodaviva #rodaviva"	4096	8	651
1216504185136925_1667030700084269	2018-05-29T16:06:28+0000	"acompanhe ciro #aovivo no evento sobre eleicoes 2018 - reformas e desenvolvimento, organizado pelo clube transatlantico e eurocamaras."	1082	1	371
1216504185136925_1667011020086237	2018-05-29T15:54:03+0000	"acompanhe ciro #aovivo no evento sobre eleicoes 2018 - reformas e desenvolvimento, organizado pelo clube transatlantico e eurocamaras."	897	2	150
1216504185136925_1666332780154061	2018-05-28T23:40:19+0000	""	3849	23	1131
1216504185136925_1665858703534802	2018-05-28T13:57:49+0000	"fala, pessoal! hoje estaremos no roda viva debatendo nossas ideias para o brasil. ajude a espalhar a noticia e acompanhe ao vivo aqui na nossa pagina a partir das 22h. #cironorodaviva"	4411	12	1948
1216504185136925_1462835707154190	2018-05-27T15:46:44+0000	"o amigo caetano veloso deu o recado! acompanhe o roda viva aqui nossa pagina do facebook na segunda, 28/05, as 22h. #cironorodaviva"	3430	14	1266
1216504185136925_1663096093811063	2018-05-26T22:01:00+0000	"turma quase completa. faltou o cacula gael!"	2066	1	61
1216504185136925_1660883117365694	2018-05-23T23:25:00+0000	"com 38 anos de vida publica, ciro gomes ja foi deputado, prefeito, governador e ministro sem nunca ter tido seu nome associado a roubalheira. chega aos 60 anos com o preparo, a firmeza, a experiencia e a honestidade que o brasil precisa."	4146	8	1728
1216504185136925_1659805354140137	2018-05-22T18:01:41+0000	"acompanhe ciro gomes #aovivo na xxi marcha a brasilia em defesa dos municipios, em brasilia - df."	1261	4	473
1216504185136925_1658623017591704	2018-05-21T13:00:21+0000	"acompanhe #aovivo a sabatina uol, folha e sbt!"	1435	3	286
1216504185136925_1658562600931079	2018-05-21T12:01:17+0000	"acompanhe aqui na nossa pagina a transmissao ao vivo da sabatina uol, folha e sbt. as 10h!"	2456	3	307
1216504185136925_1655993327854673	2018-05-20T22:37:00+0000	"nesta segunda, estaremos ao vivo pelo uol na sabatina realizada em parceria com a folha e o sbt. siga o ciro e convide seus amigos para assistir aqui na nossa pagina!"	1438	4	365
1216504185136925_1655783074542365	2018-05-18T19:31:57+0000	"a maria auxiliadora esta vendo que a situacao nao esta facil e quer saber como o brasil vai voltar a gerar empregos."	565	2	136
1216504185136925_1647803435340329	2018-05-15T12:44:00+0000	"qual o futuro das cotas nas universidades?"	1612	5	408
1216504185136925_1651940381593301	2018-05-14T22:27:11+0000	"gostei muito da convocacao da selecao brasileira. e claro que faltou alguem do meu guarany de sobral... mas confio no tite.   so lamento a ausencia de daniel alves, fora da lista por contusao.   vou torcer muito para o hexa! #vaibrasil"	1939	2	48
1216504185136925_1649503701836969	2018-05-13T15:05:00+0000	"o racismo continua existindo na nossa sociedade e precisa ser combatido diariamente."	775	1	166
1216504185136925_1646862665434406	2018-05-11T11:16:00+0000	"a michelle esta gravida do segundo filho e quer saber o que esperar para o futuro das criancas dela."	738	1	265
1216504185136925_1646858048768201	2018-05-10T11:13:00+0000	"a thais e mae do caio de 7 anos, moradora da periferia de sao paulo, e quer saber o que nos vamos fazer pra proteger o filho dela da violencia que esta a cada dia maior."	666	0	190
1216504185136925_1646455548808451	2018-05-09T13:14:10+0000	"acompanhe #aovivo ciro gomes no sindicato do comercio varejista de volta redonda."	637	6	309
1216504185136925_1645613038892702	2018-05-08T17:42:55+0000	"ciro gomes da entrevista #aovivo na 73a reuniao geral da frente nacional dos prefeitos, em niteroi - rj."	1222	2	225
1216504185136925_1641809165939756	2018-05-06T12:04:00+0000	"ciro gomes tem 38 anos de vida publica. ja foi deputado, prefeito, governador e ministro, sem nunca ter tido seu nome associado a escandalos ou roubalheira. ficha limpa, ciro gomes tem, aos 60 anos de idade, o preparo, a firmeza, a experiencia e a honestidade que o brasil precisa."	550	3	99
1216504185136925_1642472525873420	2018-05-05T14:21:02+0000	"voltamos com ciro gomes falando #aovivo no i congresso nacional do pdt diversidade!"	808	7	337
1216504185136925_1642412649212741	2018-05-05T13:14:06+0000	"ciro da entrevista #aovivo na sede do pdt em guarulhos - sp."	938	7	400
1216504185136925_1640599052727434	2018-05-03T23:41:00+0000	"como reduzir as desigualdades sociais? o ciro responde."	2256	1	735
1216504185136925_1639445472842792	2018-05-03T00:05:00+0000	"que ciro e esse?"	29079	42	57820
1216504185136925_1639350836185589	2018-05-02T18:07:15+0000	"ciro da entrevista #aovivo na agrishow em ribeirao preto - sp."	1033	5	199
1216504185136925_1637603896360283	2018-05-01T22:36:00+0000	"que bom que voce esta aqui com a gente! convide tambem seus amigos e acesse o nosso site: www.portalcirogomes.com.br ;)"	2700	5	503
1216504185136925_1637596696361003	2018-05-01T11:30:00+0000	"fiz questao de lancar o nosso site no dia do trabalho. uma homenagem a todos os trabalhadores brasileiros! acesse: www.portalcirogomes.com.br"	5201	6	2156
1216504185136925_1637136316407041	2018-04-30T15:22:02+0000	"acompanhe como foi a minha entrevista no programa agora e com datena!"	3708	3	291
1216504185136925_1635028586617814	2018-04-28T13:41:43+0000	"ciro gomes tem 38 anos de vida publica. ja foi deputado, prefeito, governador e ministro, sem nunca ter tido seu nome associado a escandalos ou roubalheira. ficha limpa, ciro gomes tem, aos 60 anos de idade, o preparo, a firmeza, a experiencia e a honestidade que o brasil precisa."	1236	0	314
1216504185136925_1634428226677850	2018-04-27T23:17:02+0000	"nos estamos muito felizes que voce esta aqui. acompanhe nossa pagina e convide seus amigos!"	1352	2	54
1216504185136925_1634413550012651	2018-04-27T22:50:54+0000	"hoje foi um dia de intenso debate sobre o brasil com trabalhadoras e trabalhadores da ugt e do sindicato dos metalurgicos de sao paulo.  essa luta e que vai fazer nosso pais crescer, se desenvolver e gerar empregos!"	1488	1	201
1216504185136925_1634096413377698	2018-04-27T17:20:22+0000	"ciro fala agora #aovivo no sindicato dos metalurgicos em sao paulo e mogi das cruzes."	1459	4	793
1216504185136925_1633930590060947	2018-04-27T13:16:25+0000	"entrevista na ugt #aovivo"	998	9	250
1216504185136925_1632969150157091	2018-04-26T15:04:26+0000	"voltamos com ciro gomes em palestra #aovivo em brasilia na xvi marcha dos vereadores."	967	6	524
1216504185136925_1632940576826615	2018-04-26T14:45:14+0000	"ciro gomes da entrevista #aovivo em brasilia na xvi marcha dos vereadores."	1715	8	681
1216504185136925_1632258790228127	2018-04-25T21:01:28+0000	"#aovivo com fernando morais. acompanhe!"	809	1	172
1216504185136925_1631258050328201	2018-04-24T22:57:51+0000	"ciro em palestra #aovivo na uninove em sao paulo."	1930	32	1044
1216504185136925_1631178207002852	2018-04-24T21:48:05+0000	"ciro da entrevista coletiva #aovivo na uninove em sao paulo."	1353	9	425
1216504185136925_1626331034154236	2018-04-20T02:08:28+0000	""	2282	2	179
1216504185136925_1625680097552663	2018-04-19T12:02:34+0000	"entrevista coletiva #aovivo no aeroporto de aragarcas - go. #diadoindio"	2208	47	1118
1216504185136925_1625576387563034	2018-04-19T09:32:30+0000	"visitarei hoje as aldeias indigenas guadalupe e sao marcos, em mato grosso.   terra do grande guerreiro mario juruna, primeiro e unico deputado federal indigena do pais, que tambem era filiado ao pdt.   junto comigo estarao carlos lupi, presidente nacional do pdt, e rafael weree, presidente do movimento indigena do nosso partido."	526	1	26
1216504185136925_1625121037608569	2018-04-18T21:54:34+0000	"sabias e generosas palavras do presidente nacional do meu partido, o pdt."	488	2	51
1216504185136925_1624952544292085	2018-04-18T17:24:17+0000	"mauro filho, que tem me ajudado a pensar o brasil, e um dos coordenadores do meu plano de governo falou hoje na camara dos deputados sobre a divida brasileira."	524	1	143
1216504185136925_1624220787698594	2018-04-17T23:15:11+0000	"#aovivo em mesa de bar no rio de janeiro. vamos debater o brasil, recuperar a democracia e retomar o desenvolvimento.  acompanhe!"	1218	9	617
1216504185136925_1623157774471562	2018-04-16T23:07:19+0000	"ciro fala agora #aovivo no sindicato assufop em ouro preto."	1385	5	711
1216504185136925_1623138024473537	2018-04-16T22:37:53+0000	"coletiva #aovivo em ouro preto - mg."	1205	8	376
1216504185136925_1622843471169659	2018-04-16T16:07:07+0000	"palestra de ciro #aovivo em minas gerais."	1329	8	412
1216504185136925_1622774591176547	2018-04-16T14:57:18+0000	"entrevista #aovivo em belo horizonte."	1520	13	321
1216504185136925_1618880431565963	2018-04-12T22:12:26+0000	"#aovivo da camara de dirigentes lojistas de fortaleza.  compartilhe!"	1546	7	674
1216504185136925_1616677735119566	2018-04-10T17:25:36+0000	""	1944	39	614
1216504185136925_1615865655200774	2018-04-09T23:20:46+0000	""	2934	106	1050
1216504185136925_1615763878544285	2018-04-09T20:50:38+0000	""	5049	130	2341
1216504185136925_1613398722114134	2018-04-07T14:22:06+0000	"viva aos economistas brasileiros!"	2075	2	490
1216504185136925_1612521032201903	2018-04-06T18:13:59+0000	"#aovivo entrevista coletiva"	10059	162	7343
1216504185136925_1612503342203672	2018-04-06T17:58:48+0000	"voltamos #aovivo"	1017	3	283
1216504185136925_1612430938877579	2018-04-06T16:52:52+0000	"#aovivo junto com alexandre padilha, vice-presidente nacional do pt, em harvard (eua).  vamos falar sobre este grave momento e as lutas que virao.   acompanhe!"	2311	23	1132
1216504185136925_1612422982211708	2018-04-06T16:48:15+0000	"#aovivo junto com alexandre padilha, vice-presidente nacional do pt, em harvard (eua).  vamos falar sobre este grave momento e as lutas que virao.   acompanhe!"	759	4	220
1216504185136925_1609174579203215	2018-04-03T17:33:02+0000	"da epoca que ainda tinha cabelo . ja sao 38 anos de vida publica dedicada ao brasil."	2075	5	143
1216504185136925_1609026602551346	2018-04-03T14:54:06+0000	"#aovivo em santos.  acompanhe!"	848	5	322
1216504185136925_1608955859225087	2018-04-03T13:37:42+0000	"#aovivo entrevista para a imprensa em santos (sp).   acompanhe!"	1310	8	359
1216504185136925_1603942916393048	2018-03-29T23:36:54+0000	"entrevista completa para a radio france internacional."	1008	1	467
1216504185136925_1603314516455888	2018-03-29T09:08:38+0000	"foi uma honra na epoca estar ao lado de grandes artistas cearenses e e um grande prazer poder relembrar. "	1124	0	69
1216504185136925_1603269569793716	2018-03-29T08:01:14+0000	"bom dia! gravei esta manha em paris entrevista para a radio france internacional.   falamos sobre o grave momento que o brasil vive, sobre as eleicoes deste ano e sobre o que temos que fazer para superar as crises politica e economica.   ela ira ao ar logo mais e compartilharei com voces!"	369	0	23
1216504185136925_1602251243228882	2018-03-28T09:41:08+0000	"voltamos #aovivo da sorbonne, paris.  acompanhe."	1317	22	926
1216504185136925_1601610626626277	2018-03-27T17:48:43+0000	"tive um dia muito agradavel na universidade de sussex, em brighton (inglaterra). alem do debate,  gravei uma entrevista sobre economia politica e relacoes internacionais com os doutorandos thomas patriota e felipe antunes, que sera disponibilizada em breve."	397	0	25
1216504185136925_1601310069989666	2018-03-27T12:23:14+0000	"#aovivo debate na universidade de sussex (inglaterra).  acompanhe!"	1243	4	845
1216504185136925_1600797816707558	2018-03-26T23:57:41+0000	"ainda sobre a visita ao centro espacial universitario, em montpellier (franca):  nesta foto estou segurando um modelo em escala real de um nanosatelite. tecnologia sensivel e extremamente importante para o futuro. detalhe: esta sendo desenvolvido com o apoio de brasileiros que encontraram na franca a chance de colocar em pratica todo seu potencial.  isso mostra que devemos avancar no brasil neste campo de estudo, pesquisa, desenvolvimento e producao. temos inteligencia, capacidade e criatividade. investir em ciencia e tecnologia e fundamental!"	709	0	147
1216504185136925_1600304216756918	2018-03-26T13:59:49+0000	"#aovivo na universidade de montpellier.  acompanhe!"	1460	14	879
1216504185136925_1600180820102591	2018-03-26T11:47:02+0000	"visitei esta manha em montpellier (franca) o instituto de sensoreamento remoto, ligado a unidade mista de pesquisa para o desenvolvimento (ird), o centro espacial universitario (csu) e o instituto de eletronica e sistemas (ies).  o conhecimento gerado e a tecnologia desenvolvida sao capazes de dar respostas para diversas questoes que vao desde a agricultura, passando por meio ambiente e ate tecnologia espacial e nanosatelites.   toda estrutura e desenvolvida em cooperacao entre o poder publico e a iniciativa privada e o pais termina por assumir protagonismo em diversas areas.   o brasil conta com algumas parcerias, como com o inpe e a embrapa, no entanto, e consenso que o nosso pais poderia desenvolver muito mais pesquisa e tecnologia. no brasil, infelizmente, os investimentos em ciencia e tecnologia sao quase nulos. isso se da pela falta de compreensao de que o desenvolvimento tecnologico e de pesquisa gera um custo infimo no inicio quando comparado aos seus resultados no futuro.   nesta tarde vou participar tambem de um debate na universidade de montpellier sobre perspectivas futuras para um brasil economicamente sustentavel e socialmente responsavel."	1498	0	351
1216504185136925_1597949696992370	2018-03-24T11:07:15+0000	"#aovivo debate com jose eduardo cardoso e christian lohbauer, durante o foro brasil espana, em barcelona.   acompanhe!"	1151	11	762
1216504185136925_1595778620542811	2018-03-22T10:31:53+0000	"bom dia. inicio nesta sexta-feira uma viagem para participar de um ciclo de debates em universidades europeias.  no sabado (24/03) estarei em barcelona (espanha) para participar do forum brasil espanha, na esade business school. na segunda-feira (26/03), irei a universidade de montpellier participar da conferencia brasil franca. na terca-feira (27/03), participarei de debate na universidade de sussex, em brighton (inglaterra). na quarta-feira (28/03) estarei na sorbonne, em paris (franca), para mais um debate.  vamos transmitir os debates por aqui. acompanhem!"	1815	1	821
1216504185136925_1593729120747761	2018-03-20T14:31:59+0000	"compartilho com voces entrevista que concedi para o programa jogo do poder rio de janeiro, com ricardo bruno e jan theophilo."	668	0	227
1216504185136925_1591937310926942	2018-03-18T17:06:20+0000	""	804	0	38
1216504185136925_1590971754356831	2018-03-17T20:15:06+0000	""	452	0	20
1216504185136925_1587456664708340	2018-03-14T14:56:12+0000	"continuacao #aovivo"	639	0	108
1216504185136925_1587440038043336	2018-03-14T14:45:44+0000	"#aovivo entrevista na camara americana de comercio. acompanhe!"	1084	8	367
1216504185136925_1586201924833814	2018-03-13T12:36:50+0000	""	262	1	15
1216504185136925_1585523508234989	2018-03-12T23:31:03+0000	"#aovivo na casa do saber.  acompanhe! compartilhe!"	1794	70	1348
1216504185136925_1585502381570435	2018-03-12T23:11:00+0000	"entrevista #aovivo em sp."	1156	3	510
1216504185136925_1584850248302315	2018-03-12T09:55:28+0000	"bom dia! hoje, as 20h, estarei na casa do saber, em sao paulo.   participe!  http://casadosaber.com.br/sp/cursos/palestra/o-brasil-que-eu-desejo-com-ciro-gomes.html"	681	0	56
1216504185136925_1583524365101570	2018-03-11T04:13:58+0000	""	589	1	18
