post_id	date	message	num_likes	num_angry	num_shares
1216504185136925_206650450053520	2018-09-15T11:24:28+0000	"obrigado, manaus. vamos juntos mudar o brasil! #ciro12 #ciropresidente"	5471	3	2028
1216504185136925_1173329912828746	2018-09-14T22:58:49+0000	"que energia maravilhosa! obrigado pela recepcao, manaus  #ciro12 #ciropresidente"	7847	10	4268
1216504185136925_340677249834287	2018-09-14T20:48:21+0000	"rio branco e #ciro12"	2587	5	1483
1216504185136925_1836501263137211	2018-09-14T20:33:49+0000	"ciro fez caminhada pelo centro comercial de rio branco, no calcadao do terminal urbano. ele abracou os eleitores, explicou sobre o programa nome limpo e falou como pretende gerar 2 milhoes de empregos ja em 2019. #ciro12 #ciropresidente"	1820	3	216
1216504185136925_276180983000916	2018-09-14T19:29:28+0000	"tem como nao ficar feliz com uma recepcao dessa? me emociono muito a cada chegada numa nova cidade sendo recebido com tanto carinho, vendo tanta gente querida indo nos acompanhar. eu sou muito grato ao povo de rio branco no acre. #ciro12"	3889	5	860
1216504185136925_1835302553257082	2018-09-14T00:00:06+0000	"ciro vai ajudar a limpar o nome de quem esta no spc. quer saber como? e facil de entender. assista ao video as 21h! #ciro12 #ciropresidente"	3411	9	1502
1216504185136925_1614097412027617	2018-09-13T22:47:55+0000	"obrigado, pessoal! foi demais! de norte a sul do pais, a nossa turma ocupou as ruas para mostrar que agora e #ciropresidente! o primeiro \"toda quarta e 12\" foi um sucesso. se voce perdeu, nao tem problema. quarta que vem tem mais. e ciro na cabeca e o coracao a mil!  veja as fotos e videos da mobilizacao por todo o brasil no nosso evento oficial: agora toda quarta e 12! e envie as fotos da sua cidade/estado no evento tambem!"	3782	5	768
1216504185136925_236302197065305	2018-09-13T18:22:59+0000	"quando estudava direito em fortaleza, na decada de 70, ciro precisou morar por um tempo em um convento. foi la que ele teve o privilegio de conhecer e conviver com frei damiao, um homem que devotou apaixonadamente a vida para cuidar dos mais pobres deste pais. saiba mais dessa historia: #tbt"	5130	4	2575
1216504185136925_273589519932244	2018-09-13T15:56:14+0000	"ontem foi dia de recarregar as baterias junto com amigos queridos, no embalo dos versos de lulu santos. um beijo, querido!"	9238	14	2325
1216504185136925_1834153843371953	2018-09-13T11:02:41+0000	"a equipe do plano de governo #ciro12 convida a populacao a contribuir com sugestoes para mudar o brasil. e so chegar com suas ideias! participe!"	3096	5	788
1216504185136925_516584635433957	2018-09-13T01:00:00+0000	"nos temos argumentos, ideias e propostas para mudar o brasil e unir o nosso pais em torno de um projeto nacional de desenvolvimento. isso e o que nos da tranquilidade para continuar em frente sem cair em armadilhas. para saber mais sobre ciro e os seus planos para o brasil voltar a crescer e gerar empregos, acesse www.cirogomes.com.br #ciro12 #ciropresidente"	7295	15	2613
1216504185136925_1833487140105290	2018-09-12T22:31:19+0000	"e agora! assista ao encontro de ciro e tico santa cruz. envie seu comentario e compartilhe! #ciro12 #ciropresidente"	4421	22	548
1216504185136925_1833146590139345	2018-09-12T18:40:44+0000	"para fazer do brasil uma grande nacao, e fundamental trazer a ciencia para o debate. nesta quinta, ciro vai falar sobre assunto em sabatina realizada pela academia brasileira de ciencias, com transmissao ao vivo aqui pela nossa pagina. acompanhe com a gente. #ciro12 #ciropresidente #todospelaciencia"	4102	7	1151
1216504185136925_1832824986838172	2018-09-12T13:45:08+0000	"#ciro12 #jornaloglobo"	2144	5	447
1216504185136925_1831756410278363	2018-09-11T22:10:10+0000	"ciro e tico santa cruz batem um papo, ao vivo, nesta quarta-feira as 19h30. voce vai poder assistir ao encontro aqui na nossa pagina e na pagina do tico www.facebook.com/ticosantacruz. fique ligado, compartilhe e participe enviando sua mensagem. #ciro12 #ciropresidente"	4718	14	1666
1216504185136925_1831738063613531	2018-09-11T21:45:08+0000	"ciro participa da sabatina que o jornal o globo realiza em parceria com a revista epoca e o jornal valor economico, na manha de desta quarta-feira. marque na sua agenda e convide seus amigos para assistir aqui na nossa pagina. #ciro12 #ciropresidente #jornaloglobo"	2987	6	826
1216504185136925_1831410003646337	2018-09-11T15:31:52+0000	"em taboao da serra ouvindo eleitores e recebendo o carinho das pessoas ao lado do candidato a governador pelo pdt, marcelo candido e a senador, antonio neto. #ciro12 #ciropresidente  fotos: leo canabarro"	1827	4	188
1216504185136925_245478859503747	2018-09-10T23:49:51+0000	"agora, toda quarta e 12! nesta, e em todas as quartas-feiras ate a eleicao, vamos ocupar as ruas para mostrar que estamos com ciro! confirme presenca no evento https://www.facebook.com/events/230522500976970/. participe! #ciro12 #ciropresidente"	8756	12	4242
1216504185136925_1830047650449239	2018-09-10T15:41:12+0000	"nosso cirao faz caminhada em maua, regiao metropolitana de sao paulo, onde foi recebido com muita alegria e esperanca pelos eleitores. cada vez mais pessoas tem acompanhado o candidato em sua andanca pelo pais. em maua, ciro esteve acompanhado de marcelo candido, gleides sodre, antonio neto e junior orosco do pdt, e dos nossos incansaveis apoiadores que tem estado presentes em todos os cantos desse brasil! . se quiser saber mais sobre o que nosso futuro presidente pensa para mudar o pais, acesse https://www.cirogomes.com.br.  fotos: leo canabarro"	2786	4	262
1216504185136925_2030792763651146	2018-09-10T00:00:14+0000	"definitivamente tenho a melhor turma na internet! obrigado a todas e todos pelo apoio. vamos mudar o brasil!   #ciro12  #gazetaestadaojp"	7381	8	4020
1216504185136925_481745922301297	2018-09-09T23:56:58+0000	"olha o recado da nossa candidata a vice-governadora de sao paulo pelo pdt, gleides sodre! #ciro12 #gazetaestadaojp"	1316	3	140
1216504185136925_325697441517040	2018-09-09T23:47:14+0000	"ciro vai levar a escola profissionalizante de tempo integral para o ensino medio de todo o brasil. uma escola atraente, moderna, com tres refeicoes diarias, onde o jovem tenha o prazer de estar o dia inteiro. o aluno faz o ensino medio e ao mesmo tempo aprende uma profissao de nivel tecnico. no final, faz estagio numa empresa com salario pago pelo governo. parece sonho? no ceara ja existe. conheca mais essa proposta, acessando https://www.cirogomes.com.br/propostas/escola-profissionalizante-de-tempo-integral/."	14571	39	10642
1216504185136925_1827395574047780	2018-09-08T21:19:15+0000	"a regiao do cariri/ce recebeu ciro com muita alegria na manha deste sabado. durante carreata de juazeiro do norte ate o crato, o candidato acenou para os eleitores e recebeu muito carinho do povo cearense.  fotos: leo canabarro"	2703	2	303
1216504185136925_711047825921738	2018-09-08T20:22:46+0000	"sempre me emociono ao ver realizacoes como o acude do boqueirao na paraiba. antes da transposicao do sao francisco essa mesma area era completamente seca. #nordestecomciro #ciro12"	4134	2	1139
1216504185136925_1827329204054417	2018-09-08T19:59:09+0000	"como e bonito o acude do boqueirao na paraiba, antes essa mesma area era completamente seca. so foi possivel com a transposicao do rio sao francisco. e por isso que cada vez mais as pessoas estao buscando saber sobre ciro! a cada nova agenda tem mais gente querendo mudar. #nordestecomciro #ciro12"	1911	1	280
1216504185136925_234301230592777	2018-09-08T17:57:22+0000	"cada vez mais gente com #ciropresidente! em campina grande nao foi diferente. olha a multidao gritando! o povo quer mudanca. brasil pra frente, ciro presidente! "	8238	6	3650
1216504185136925_294157564715017	2018-09-08T14:40:25+0000	"de juazeiro do norte ate o crato, sol e muita alegria! e ciro! #nordestecomciro #ciro12 #ciropresidente"	2964	0	416
1216504185136925_2072345202799375	2018-09-08T14:24:33+0000	"chegada a juazeiro do norte/ce #ciro12 #ciropresidente"	6069	5	2711
1216504185136925_294757457971461	2018-09-08T01:49:21+0000	"alegria! 15 mil pessoas participaram de um dos momentos mais emocionantes da campanha! esta multidao recebeu ciro com festa em sobral, a cidade que possui a melhor educacao publica do brasil e que tambem e a terra natal do nosso candidato! a noite de sexta terminou com um grande comicio no municipio de massape, com a presenca de katia abreu nossa candidata a vice, cid gomes, candidato ao senado, camilo santana, candidato a reeleicao como governador do ceara e a candidata a vice-governadora izolda cela. o ceara e #ciro12 #ciropresidente  imagens: giovanna duarte"	6222	3	1994
1216504185136925_287037122025682	2018-09-08T00:36:47+0000	"ciro #aovivo no ceara! #ciro12 com katia abreu,  cid gomes 123 senador e camilo governador."	6265	51	2788
1216504185136925_1824522584335079	2018-09-06T21:40:08+0000	"agradeco imensamente a recepcao que tive em caruaru. e quero deixar meu agradecimento especial ao povo do pernambuco, a mauricio rands governador, isabella de roldao, ze queiroz, wolney queiroz 1234 e tulio gadelha que certamente representarao os anseios desse povo tao guerreiro.  #ciro12 #ciropresidente #nordestecomciro  fotos: leo canabarro"	2649	0	324
1216504185136925_1824258621028142	2018-09-06T17:01:25+0000	"hoje pela manha ciro esteve em aracaju/se. participou de evento junto com valadares filho, candidato a governador, silvia fontes, vice-governadora, valadares e henry clay, candidatos ao senado e fabio henrique, candidato a deputado federal. #ciro12 #ciropresidente"	1421	1	158
1216504185136925_439833069757622	2018-09-06T16:35:07+0000	"milhoes de mulheres e homens acordaram hoje no brasil sem ter um emprego, sem saber como vao fazer para pagar as contas no fim do mes, se virando de tudo quanto e jeito para dar o que comer a seus filhos.  para comecar a resolver isto, ciro criou um plano emergencial de empregos que vai gerar milhares de postos de trabalho ja em 2019. saiba mais no nosso site e veja o passo a passo: https://www.cirogomes.com.br/"	8369	10	5014
1216504185136925_689319918094661	2018-09-06T15:55:11+0000	"eu tenho pouco tempo de tv, mas muitas ideias para mudar o brasil e fazer o nosso pais voltar a gerar empregos. acesse nosso site, assista ao programa e saiba mais sobre a nossa proposta: https://www.cirogomes.com.br/propostas/plano-emergencial-de-empregos/"	3307	0	1519
1216504185136925_340168963479549	2018-09-05T22:17:12+0000	"acompanhe ciro #aovivo em um encontro com advogados na sede da oab-mg."	3870	14	1255
1216504185136925_742324566118513	2018-09-05T21:56:00+0000	"o prefeito da cidade de belo horizonte, alexandre kalil, declarou hoje apoio a ciro gomes.  ciro ficou emocionado com o apoio e disse que vai ajudar minas a superar suas dificuldades. o encontro ocorreu na casa de kalil e depois eles seguiram para uma coletiva de imprensa.  veja as fotos. #ciro12 #ciropresidente  fotos: leo canabarro"	1538	1	291
1216504185136925_462693794226842	2018-09-05T17:01:55+0000	"queremos levar as ideias do ciro a todos os cantos desse pais. quem voce conhece que ainda nao segue o ciro? marca, compartilha e traz pra gente ;) #trazmaisum"	1973	2	607
1216504185136925_1822735984513739	2018-09-05T15:39:44+0000	"domingo tem mais um debate entre presidenciaveis e ciro vai estar la! dessa vez o encontro e promovido pela tv gazeta, estadao, radio jovem pan e twitter brasil. marque na agenda e nos ajude a divulgar. #ciro12 #gazetaestadaojp"	2359	0	670
1216504185136925_2185716075081523	2018-09-04T22:23:16+0000	" o ciro ja disse que vai resolver, vai tirar seu nome do spc  ciro conversou com eleitores hoje no centro de sao paulo sobre o programa nome limpo. veja algumas imagens do encontro ao som do sambao do spciro: ciro ja disse, de rodrigo lessa e luiz carlos silva.  fotos: leo canabarro"	1843	0	303
1216504185136925_1821656281288376	2018-09-04T17:02:08+0000	"viva o humor!"	5727	2	1782
1216504185136925_905549909644868	2018-09-04T10:01:23+0000	"ajudar a limpar o nome de 63 milhoes de brasileiros que estao no spc e fundamental para reativar o consumo das familias, um dos principais motores da economia. quando a economia melhora, tudo melhora. e os empregos aparecem!"	2010	1	518
1216504185136925_1820684068052264	2018-09-04T00:31:00+0000	"faltam apenas 20% do valor para atingirmos a meta. ajude o ciro a divulgar suas ideias nas redes sociais! acesse: https://doe.cirogomes.com.br"	1702	0	154
1216504185136925_1820254851428519	2018-09-03T16:05:24+0000	"em curitiba, ciro foi o primeiro candidato a assinar um compromisso com a campanha mobilidade ativa nas eleicoes 2018 para garantir a criacao de politicas publicas focadas em mobilidade urbana.  foto: eduardo matysiak"	4947	0	1133
1216504185136925_1820216911432313	2018-09-03T15:30:16+0000	"nesta terca-feira ciro estara na sabatina estadao-faap!  assista ao vivo aqui pela nossa pagina. #cirogomesnoestadao"	978	0	160
1216504185136925_1820103928110278	2018-09-03T13:45:18+0000	"#cironouol #uolnasurnas"	9001	3	3014
1216504185136925_663314410718892	2018-09-02T22:00:01+0000	"ciro terminou a agenda de sabado no encontro com coletivo sindical de londrina e regiao. acompanhado dos senadores requiao e nelton friedrich, do candidato a governador joao arruda, do candidato a deputado federal barbosa neto e do candidato a deputado estadual sandro adao. ciro citou os numeros alarmantes de desemprego, da violencia contra a mulher, da crise socioeconomica que o pais enfrenta. ele chamou atencao tambem para 220 mil pontos de comercio fechados nos ultimos tres anos e das 13 mil industrias que pararam de produzir. ciro falou da necessidade de mobilizar a sociedade brasileira para entender a natureza da \"doenca\" que se instalou no pais e falou do seu sonho de unir essa grande nacao.  fotos: leo canabarro"	1367	2	172
1216504185136925_1818036941650310	2018-09-02T17:09:15+0000	"ciro recebeu o ja tradicional carinho do povo gaucho em sua visita a cidade de osorio, na ultima sexta-feira. na passagem pela expointer e em encontro com apoiadores e militantes, ciro lembrou a importancia do rio grande do sul na construcao da nossa democracia e conclamou nossas irmas e irmaos dos pampas a apostarem na mudanca que sua candidatura representa. #ciro12 #ciropresidente"	1532	1	159
1216504185136925_1818920218228649	2018-09-02T16:35:37+0000	"a semana comeca com sabatina! nesta segunda, ciro responde as perguntas de jornalistas da folha, uol e sbt: assista ao vivo aqui pela nossa pagina. #cironouol"	1820	1	417
1216504185136925_2227824424106137	2018-09-02T15:48:34+0000	"ciro #aovivo em jundiai (sp). com marcelo candido, antonio neto, gerson sartori e pedro bigardi."	2750	13	1413
1216504185136925_297742271027283	2018-09-02T14:00:25+0000	"mais um recado do poeta rodolfo pra voces. a revista veja tentou atacar ciro, mas so conseguiu foi unir a nossa militancia. ciro e ficha limpa, e isso que os baroes nao suportam."	834	1	206
1216504185136925_1817941914993146	2018-09-01T22:21:53+0000	"ciro comecou esse sabado em curitiba. nosso candidato esteve no centro da capital, recebeu os abracos do povo paranaense e tambem visitou a pastoral da crianca e o museu da vida, que dissemina e fortalece o legado de zilda arns na protecao da infancia no pais."	1313	1	131
1216504185136925_316494625775666	2018-09-01T21:55:33+0000	"acompanhe ciro #aovivo no encontro com coletivo sindical de londrina e regiao. com os senadores requiao e nelton e o futuro governador joao arruda."	2460	3	760
1216504185136925_1982438628461428	2018-09-01T16:03:30+0000	"milhoes de brasileiros ficaram sem condicoes de honrar seus compromissos depois da crise e do desemprego, viram suas dividas subirem que nem foguete, por causa dos juros, e foram parar no spc. sao 63 milhoes de pessoas nessa situacao. ciro sabe como fazer para limpar desses homens e mulheres, assista em nosso programa. para conhecer nossas propostas acesse: https://www.cirogomes.com.br"	5327	18	1656
1216504185136925_459464761238715	2018-09-01T15:43:22+0000	"eu tenho pouco tempo de tv, mas muitas ideias para mudar o brasil. acesse nosso site, assista ao programa, leia a cartilha e saiba mais sobre a nossa proposta: https://www.cirogomes.com.br/propostas/spc-programa-e-cartilha"	4642	2	1909
1216504185136925_252505648929142	2018-09-01T14:16:25+0000	"ciro #aovivo com trabalhadoras e sindicalistas em curitiba (pr)."	3429	7	1144
1216504185136925_1817234828397188	2018-09-01T13:07:48+0000	"estou em curitiba com nossos candidatos ao senado roberto requiao e nelton friedrich! #ciro12 #ciropresidente"	1642	2	103
1216504185136925_471160540025319	2018-09-01T00:19:34+0000	"ciro #aovivo em osorio (rs) com o nosso candidato a governador jairo jorge."	2862	13	965
1216504185136925_1816598318460839	2018-09-01T00:10:41+0000	"osorio, no rio grande do sul, ja decidiu! e #ciropresidente do brasil  "	1516	1	244
1216504185136925_297536784360450	2018-08-31T19:12:04+0000	"minha proposta de limpar o nome de quem esta no spc nao e dificil de fazer, nem de entender. veja o video e, para saber mais, acesse: https://www.cirogomes.com.br #ciro12 #ciropresidente"	4031	5	965
1216504185136925_1817982364989101	2018-08-31T22:00:11+0000	"se voce acha que o brasil precisa mudar, estamos juntos. confira um dos primeiros comerciais da nossa campanha no horario eleitoral. temos pouco tempo de tv, mas muitas ideias para mudar o brasil. para saber mais, acesse: https://www.cirogomes.com.br. #ciro12 #ciropresidente"	3637	5	1310
1216504185136925_1814654465321891	2018-08-30T19:35:26+0000	"ciro visitou hoje o laboratorio de genomica e proteomica da unicamp, acompanhado do professor goncalo. tambem estavam presente antonio neto, candidato ao senado por sao paulo, tabata amaral, candidata a deputada federal, gabriel cassiano, candidato a deputado estadual e gerson sartori, candidato a deputado federal. la alem de conhecer o laboratorio e ouvir mais sobre biocombustiveis, ciro conversou com os alunos, professores e pesquisadores da unicamp. fotos: leo canabarro"	1725	1	258
1216504185136925_1814490608671610	2018-08-30T16:30:25+0000	"ja ja estarei ao vivo no programa balanco geral da record campinas, onde conversarei com jair dupra. conto com a audiencia de voces de campinas e regiao. vamos juntos mudar esse pais! #ciropresidente #ciro12"	1427	0	33
1216504185136925_278389589556511	2018-08-29T22:58:06+0000	"nos temos um projeto para mudar o brasil e queremos voce do nosso lado. mais de 1.000 pessoas ja se comprometeram com esse projeto e fizeram uma doacao. acesse https://doe.cirogomes.com.br e colabore voce tambem. #ciro12 #ciropresidente"	50203	75	12390
1216504185136925_1813163782137626	2018-08-29T20:05:34+0000	"infancia e um tema serio. assinei em brasilia um compromisso garantindo a criacao e implementacao de politicas publicas para fortalecimento dos direitos da crianca na primeira infancia. o documento foi entregue por miriam cordeiro-pragita da rede nacional pela primeira infancia."	3154	0	622
1216504185136925_945384492313418	2018-08-29T17:51:30+0000	"reuniao com reitoras e reitores, na andifes, em brasilia."	2647	11	991
1216504185136925_1813014735485864	2018-08-29T17:40:18+0000	"ciro visitou o mercado central de belo horizonte, na manha desta quarta. entre um queijinho aqui e outro ali, ciro recebeu o carinho dos mineiros e falou aos jornalistas sobre investimentos no estado e da necessidade de retomar as obras de infraestrutura para acompanhar o crescimento do agronegocio.  fotos: leo canabarro"	1483	0	229
1216504185136925_805962133073982	2018-08-29T11:51:36+0000	"lembra da pequena lara? ela e o papai dela, o marcos, sao fas do ciro e gravaram um video super fofo cantando o nosso jingle (veja nos nossos comentarios). quando esteve em palmas, ciro se encontrou com o marcos e aproveitou a chance pra agradecer a nossa pequena larinha! "	1414	1	218
1216504185136925_698420233841079	2018-08-29T00:00:02+0000	"o regime de capitalizacao e a melhor saida para a nossa previdencia. ate quem achava que nao era possivel, agora comeca a se dar conta dessa necessidade. faca como os outros candidatos, siga o ciro."	2861	4	909
1216504185136925_228853657793395	2018-08-28T18:56:23+0000	"o poeta rodolfo resumiu em versos a participacao de ciro no jornal nacional. se voce ainda nao assistiu a entrevista, clique aqui -> http://bit.ly/2oi49ld."	1181	2	222
1216504185136925_1811506875636650	2018-08-28T17:52:24+0000	"ciro foi recebido com abracos calorosos e muita festa pelos moradores da cidade de sao goncalo, no rio de janeiro. ao lado do candidato a governador pedro fernandes (pdt) e do candidato ao senado jose bonifacio (pdt), ciro conversou com comerciantes sobre seu projeto para o brasil e principalmente sobre situacao da seguranca publica no rio.  fotos: leo canabarro"	1176	1	212
1216504185136925_1810578842396120	2018-08-28T02:31:35+0000	"sigo afirmando: lupi e um homem serio! leia nota publicada hoje."	7410	4	1386
1216504185136925_1810522149068456	2018-08-28T01:28:22+0000	"#cironaglobonews #ciro12"	2262	1	574
1216504185136925_1810404795746858	2018-08-27T23:31:25+0000	"o programa nome limpo vai resgatar a dignidade e devolver os sonhos para 63 milhoes de brasileiros. acesse: www.cirogomes.com.br e saiba tudo sobre a proposta! #ciropresidente #ciro12 #cironojornalnacional"	7065	6	1772
1216504185136925_288552898592154	2018-08-27T22:55:23+0000	"e daqui a pouco! a partir das 20h30, logo no 1o bloco, tem #cironojornalnacional  nao perca!"	4626	8	793
1216504185136925_2217410588490591	2018-08-27T15:16:51+0000	"poeta rodolfo ja deu o recado! hoje as 20h30 tem #cironojornalnacional. nao perca!"	695	1	117
1216504185136925_295385701256745	2018-08-26T18:07:53+0000	"ainda na decada de 90 escrevi um livro no qual propus, entre outras coisas, um iva (imposto sobre valor agregado), que e um unico imposto que substitui varios outros. as liderancas politicas de sao paulo sempre foram contra. parece que o jogo mudou.  faca como os candidatos: siga o ciro!"	3350	4	1147
1216504185136925_1808847082569296	2018-08-26T16:29:26+0000	"ciro aproveitou a manha deste domingo para ir a feira em itaquera, na zona leste de sao paulo. ao lado de antonio neto, candidato ao senado pelo pdt,  bateu um papo com os feirantes sobre o movimento das vendas e a compra de insumos. tambem recebeu o carinho e os muitos abracos de sempre que, nessa manha fria na capital paulista, ajudaram a aquecer.  fotos: leo canabarro"	1092	3	116
1216504185136925_459930327833686	2018-08-26T13:56:42+0000	"o gabriel emocionou  a todos que estiveram presentes no encontro de mobilizacao da juventude do pdt e das paginas apoiadoras de ciro. veja como foi. "	17370	14	12780
1216504185136925_1807601212693883	2018-08-25T21:20:40+0000	"manha de sabado revigorante em sao paulo. nosso cirao da massa esteve cercado de centenas de jovens cheios de paixao pelo brasil e vontade de mudar o destino desta nacao. foram quase tres horas de carinhos, abracos e bate papo. energias renovadas, galera reunida, chegou o momento de avancar!  fotos: leo canabarro"	1536	2	129
1216504185136925_1807318172722187	2018-08-25T16:03:18+0000	"nao perca, nesta segunda-feira tem ciro na bancada do jornal nacional. comente, compartilhe e use a tag #cironojornalnacional"	6916	4	2802
1216504185136925_451580071996039	2018-08-25T13:37:19+0000	"e agora! muitas ideias, uma missao! ciro se encontra com apoiadores de todo o brasil. acompanhe ao vivo, direto da barra funda, em sao paulo. #vempramassa #tamojuntopramudar"	2430	14	1158
1216504185136925_1806163919504279	2018-08-24T22:37:20+0000	"sao esses abracos que me dao energia para continuar na luta."	1895	4	190
1216504185136925_301951450569332	2018-08-24T22:06:16+0000	"ciro esteve em cuiaba/mt, no comeco da tarde desta sexta-feira. ao lado do candidato a governador mauro mendes (dem) e o candidato a vice-governador otaviano pivetta (pdt)."	680	3	59
1216504185136925_1806031489517522	2018-08-24T20:41:51+0000	"a convite de sua vice, a senadora katia abreu, ciro passou a manha e a tarde desta sexta-feira em palmas/to. participaram de um evento com representantes de setores sobre economia, industria, comercio e agronegocio.  fotos: leo canabarro"	800	2	81
1216504185136925_258153498165882	2018-08-23T22:53:09+0000	"chuva e sol, poeira e carvao, longe de casa sigo o roteiro mais uma estacao. hoje, em ceilandia-df, invocamos luiz gonzaga para aquecer um pouco mais os nossos coracoes e a vontade de percorrer cada canto desse pais maravilhoso que e o brasil."	8357	19	5483
1216504185136925_260652484574475	2018-08-23T22:26:38+0000	"em campo grande-ms ''a juventude ja decidiu, e ciro gomes presidente do brasil!''. #ciro12 #ciropresidente"	899	1	101
1216504185136925_268654497191740	2018-08-23T14:28:01+0000	"e neste sabado, dia 25/08. a partir das 9h, todo mundo que milita com ciro na internet vai passar um dia inteiro junto para trocar informacoes, contatos e fortalecer os lacos para eleger ciro presidente. se voce estiver em sao paulo, de uma passada por la. inscreva-se:http://bit.ly/2muzhys"	3260	9	1167
1216504185136925_1803190686468269	2018-08-23T11:04:11+0000	"amigos da internet, venham discutir as ideias para devolver a esperanca ao nosso pais! #tamojuntopramudar sabado, 25 de agosto, as 09h. presencas confirmadas: ciro gomes, mangabeira unger e nelson marconi.  inscreva-se, vagas limitadas: www.eventbrite.com.br/e/muitas-ideias-uma-missao-eleger-ciro-presidente-tickets-49229592035"	1401	1	161
1216504185136925_1802225316564806	2018-08-22T22:45:33+0000	"ciro esteve em osasco-sp na manha desta quarta-feira (22/08) para uma caminhada no centro da cidade.  fotos: leo canabarro"	1089	1	121
1216504185136925_1802193769901294	2018-08-22T22:15:35+0000	"ciro respondeu as perguntas de jornalistas no programa redacao globo, da radio globo, na tarde desta quinta-feira, em sao paulo. durante meia hora, ciro falou sobre suas propostas e tambem sobre a atual conjuntura eleitoral. assista: http://bit.ly/2n8fbqq"	848	1	60
