post_id	date	message	num_likes	num_angry	num_shares
398845206932703_1026173484199869	2018-05-01T14:20:55+0000	"acabei de chegar em curitiba para o ato nacional do 1 de maio pela democracia. nossa solidariedade tambem as familias sem-teto que ocupavam o predio que pegou fogo e desabou nesta madrugada."	1556	92	774
398845206932703_1024640521019832	2018-04-29T02:13:59+0000	"estamos aqui no muro da vergonha, a 20 minutos de jerusalem, na passagem dos trabalhadores palestinos pelo ponto de controle e revista do exercito israelense. o muro segrega os territorios palestinos e viola as resolucoes da onu e o direito internacional. #palestinalivre"	779	15	299
398845206932703_1024489257701625	2018-04-28T19:37:37+0000	"a luta por moradia no brasil e urgente e necessaria. temos mais de 6 milhoes de familia sem casa e mais de 7 milhoes de imoveis abandonados. ha mais casa sem gente do que gente sem casa. entenda por que ocupamos. #mtst #vamoscomboulosesonia #psol2018"	4955	52	12711
398845206932703_1014583075376181	2018-04-26T23:00:00+0000	"o esquerda online acompanhou de perto todas as nossas agendas em porto alegre durante a semana passada. confira! #vamoscomboulosesonia #psol2018"	231	0	77
398845206932703_1021684064648811	2018-04-24T01:30:29+0000	"cenas de selvageria contra professoras em belo horizonte. inadmissivel a repressao policial do governo do estado contra quem educa nossos filhos."	1044	39	578
398845206932703_1020921788058372	2018-04-22T16:59:39+0000	"#aovivo nos queremos ocupar a politica! confira como foi a entrevista minha e de sonia bone guajajara na tv assembleia de minas gerais. #boulos2018 #vamoscomboulosesonia #namidia"	993	11	595
398845206932703_1018499704967247	2018-04-21T17:47:36+0000	"o controle da midia nao pode ser o controle remoto. e preciso diversificar o cardapio de vozes na midia. #boulos2018 -- confira na integra entrevista que dei ao nocaute - blog do fernando morais: https://youtu.be/oldpe3yo014"	1018	3	416
398845206932703_1020315964785621	2018-04-21T16:27:35+0000	"ontem na universidade federal do rio grande do sul, obrigado turma! #boulos2018 #vamoscomboulosesonia"	575	1	141
398845206932703_1019884008162150	2018-04-20T22:58:27+0000	"#aovivo palestra na pucrs em porto alegre"	1448	6	744
398845206932703_1019770448173506	2018-04-20T18:25:06+0000	"#aovivo coletiva de imprensa na assembleia legislativa do estado do rio grande do sul"	654	3	271
398845206932703_1019305304886687	2018-04-20T00:21:40+0000	"#aovivo estou na puc em belo horizonte, participando do debate \"resistencia democratica: por que ocupamos a politica?\", com aurea carolina, duda salabert, nana oliveira, iza lourenca, renata regina e jose luiz quadros magalhaes. #boulos2018"	752	2	215
398845206932703_1018498471634037	2018-04-19T15:00:06+0000	"vamos abrir a caixa preta do judiciario. #boulos2018 -- confira na integra entrevista que dei ao nocaute - blog do fernando morais: https://youtu.be/oldpe3yo014"	1252	4	649
398845206932703_1018918314925386	2018-04-19T10:55:10+0000	"#aovivo escute minha entrevista para a radio super noticia fm de belo horizonte."	944	61	203
398845206932703_1018750224942195	2018-04-19T02:14:18+0000	"hoje passei o dia na capital mineira e participei da assembleia do sindute com milhares de trabalhadoras e trabalhadores da educacao, conheci a ocupacao vicentao, importante polo de resistencia da luta por moradia em belo horizonte, caminhei junto de ambulantes e indigenas na regiao central de bh e ainda tive a honra de estar ao lado de mulheres incriveis para uma homenagem a marielle na camara municipal de belo horizonte coordenado pelas vereadoras do muitas aurea carolina e cida falabela. amanha estarei na puc e na ufmg para mais um dia de debates. vamos juntos! #vamos2018"	181	1	5
398845206932703_1018351721648712	2018-04-18T11:43:33+0000	"#aovivo acompanhe minha entrevista para radio argentina am750."	369	0	105
398845206932703_1018044455012772	2018-04-17T21:36:30+0000	"e inviavel um projeto de transformacao da sociedade no brasil hoje dentro desse modelo de governabilidade. temos que partir da premissa que esse sistema esta falido e construir um novo modelo, com o povo nos processos de decisao. --  confira a integra da minha entrevista para o nocaute - blog do fernando morais: https://youtu.be/oldpe3yo014 #vamoscomboulosesonia #vamos2018"	653	3	289
398845206932703_1788407451218902	2018-04-17T15:40:34+0000	"a minha parceira de pre- candidatura sonia bone guajajara convida a todas e todos para participar do acampamento terra livre 2018, a maior mobilizacao indigena do pais.  #atl2018 #terralivre #vamoscomboulosesonia"	184	1	36
398845206932703_1017745625042655	2018-04-17T11:02:51+0000	"#aovivo em entrevista para a radio caxias fm. acompanhe!"	489	3	130
398845206932703_1016701015147116	2018-04-16T12:42:35+0000	"boulos fala agora: povo sem medo ocupam triplex do guaruja! #lulalivre #povosemmedo #vamos"	8313	683	11026
398845206932703_1016595841824300	2018-04-16T12:04:35+0000	"mtst e povo sem medo ocupam o triplex do guaruja. #lulalivre #povosemmedo"	11227	1424	23481
398845206932703_1015304821953402	2018-04-14T02:10:00+0000	"hoje estive em lisboa tambem com rafa mayoral, do podemos espanhol. defendemos juntos a luta pela democracia brasileira, por justica para marielle franco e pela liberdade de lula.  #mariellevive  #vamos2018 #psol"	569	3	155
398845206932703_1015297838620767	2018-04-14T01:30:57+0000	"estive hoje em lisboa com a deputada portuguesa joana mortagua do bloco de esquerda na luta pela democracia e pela liberdade de lula no brasil. #vamoscomboulosesonia #vamos2018"	355	1	63
398845206932703_1015159608634590	2018-04-13T19:30:30+0000	"#aovivo em lisboa. encerrando a jornada de defesa da democracia em portugal. partindo para o rio de janeiro para o ato justica por marielle apos 1 mes da execucao #mariellevive"	732	2	270
398845206932703_1014467848703766	2018-04-12T16:56:41+0000	"direto de lisboa. noticias da resistencia internacional pela democracia. #lulalivre #mariellevive"	3552	256	2904
398845206932703_1013743578776193	2018-04-11T11:33:24+0000	"vim trazer minha solidariedade a lula. estou agora em curitiba, em frente da sede da policia federal, no acampamento #lulalivre."	340	0	34
398845206932703_1013486985468519	2018-04-11T00:38:04+0000	"defender a liberdade de lula e defender a democracia brasileira. e por isso que estarei amanha em curitiba e depois de amanha em portugal para denunciar os ataques a nossa democracia. #vamoscomboulosesonia #lulalivre"	2175	2	1025
398845206932703_1013436592140225	2018-04-10T23:17:59+0000	"#aovivo nadir kfouri e marielle franco, presentes! participo de homenagem a duas mulheres que enfrentaram o militarismo na luta pela democracia, no tucarena em sp"	643	5	263
398845206932703_1012578138892737	2018-04-09T13:58:03+0000	"filhos de lula participaram de mobilizacao do povo sem medo em sao bernardo pela liberdade do ex-presidente. lurian silva falou em nome da familia.   midia ninja   #lulalivre #povosemmedo"	1741	9	1346
398845206932703_1012180042265880	2018-04-08T21:39:50+0000	"ocupacao povo sem medo de sao bernardo faz grande ato por lula livre #aovivo"	2079	8	1024
398845206932703_1012037285613489	2018-04-08T18:54:41+0000	"#aovivo ultima assembleia da vitoriosa ocupacao povo sem medo de sao bernardo."	2566	39	1967
398845206932703_1010195382464346	2018-04-05T23:45:30+0000	"povo sem medo chegando no sindicato dos metalurgicos do abc #lulalivre"	1420	18	472
398845206932703_1010096705807547	2018-04-05T21:37:32+0000	"todos para sao bernardo em defesa da democracia e contra a prisao de lula!"	5686	928	4599
398845206932703_1010076312476253	2018-04-05T20:51:09+0000	"nos nao vamos assistir passivamente a prisao de lula, no que depender de nos havera resistencia! #lulalivre #psol"	6026	81	6520
398845206932703_1009576772526207	2018-04-05T01:12:27+0000	"#aovivo  mtst em frente a casa do lula"	1376	9	772
398845206932703_1008451399305411	2018-04-03T02:40:13+0000	"primeiro dia intenso de atividades no vamos nordeste! passamos pela cidade de acailandia e depois por imperatriz, no maranhao, sempre muito bem acompanhados! os desafios sao enormes assim como a disposicao da sonia bone guajajara e a minha para enfrenta-los! #vamos2018 #vamoscomboulosesonia"	122	0	5
398845206932703_1008377695979448	2018-04-02T23:51:15+0000	"#aovivo participo agora da mesa \"vamos falar de direitos, justica e democracia\" ao lado da sonia bone guajajara, conceicao amorim e professor dr. alexandre peixoto #vamoscomboulosesonia #vamospelonordeste"	199	0	103
398845206932703_1008341555983062	2018-04-02T22:41:40+0000	"participo agora da mesa \"vamos falar de direitos, justica e democracia\" ao lado da sonia bone guajajara #aovivo na ufma em imperatriz, no maranhao #vamoscomboulosesonia #vamospelonordeste"	183	2	56
398845206932703_1007579486059269	2018-04-01T15:12:55+0000	"mujica, grande inspiracao #vamos2018"	1076	0	843
398845206932703_1006185062865378	2018-03-30T17:00:00+0000	"\"o voto nao pode ser como um cheque em branco que voce vai la e assina e depois podem fazer o que quiser com ele\" esse e um trecho da minha entrevista para o jornalistas livres. assista na integra: http://bit.ly/2ig7nno #vamoscomboulos #vamos2018"	1246	7	368
398845206932703_1005864236230794	2018-03-29T18:13:11+0000	"a democracia vai vencer o odio!  nossa tradicao nao e da intolerancia, nem do pensamento unico, por isso iremos lutar e juntos derrotar o fascismo.  #atentadocontraademocracia #atentadocontralula #vamos2018   em colaboracao com tropico"	653	6	163
398845206932703_1004879829662568	2018-03-29T18:00:00+0000	"muito obrigado pelo apoio, frei betto, voce e uma inspiracao sempre.  #vamoscomboulos #vamos2018"	166	0	43
398845206932703_1005803592903525	2018-03-29T16:35:21+0000	"otima conversa com os jornalistas livres sobre a nossa pre-campanha e diversos temas do brasil. confira a entrevista na integra! #vamos2018 #vamoscomboulosesonia #psol"	167	0	138
398845206932703_1005345992949285	2018-03-28T23:58:19+0000	"#aovivo participo agora do ato supra partidario em defesa da democracia em curitiba. contra o odio e a violencia!"	2433	38	517
398845206932703_1005379646279253	2018-03-28T23:57:55+0000	"#aovivo participo agora do ato supra partidario em defesa da democracia em curitiba. contra o odio e a violencia!"	381	4	85
398845206932703_1005250342958850	2018-03-28T18:07:47+0000	"mobilizacao em curitiba hoje contra as agressoes a lula e o fascismo. unidade pela democracia!"	962	11	530
398845206932703_1004877312996153	2018-03-28T13:00:00+0000	"a cantora teresa cristina tambem apoia a nossa chapa de pre-candidatura a presidencia. obrigado, querida, vamos juntos! #vamoscomboulosesonia #vamos2018 #psol"	127	0	19
398845206932703_1004828079667743	2018-03-28T01:35:35+0000	"nosso repudio as agressoes contra caravana de lula. o momento exige unidade democratica contra o fascismo."	1411	28	1378
398845206932703_1110856339072510	2018-03-26T18:20:22+0000	"lindo video feito das mulheres negras para marielle. #mariellevive #mariellepresente"	209	0	75
398845206932703_1003595889790962	2018-03-26T11:00:00+0000	"parabens pelos seus 96 anos partido comunista brasileiro - pcb! estamos juntos, ombro a ombro nas lutas e esse ano vamos enfrentar um novo desafio, vamos sem medo! e uma honra contar com voces nessa caminhada. #vamos2018"	660	3	221
398845206932703_1002834073200477	2018-03-24T21:26:34+0000	"estamos em cotia, sao paulo, em debate com movimentos e liderancas locais #vamoscomboulos #aovivo #psol"	264	2	139
398845206932703_1109003432591134	2018-03-24T13:00:00+0000	"o nosso sonho nao acabou, ele esta so comecando! emocionante o discurso do pastor henrique vieira no ato em homenagem a marielle e anderson no rio de janeiro essa semana. #mariellevive"	402	1	167
398845206932703_1001637689986782	2018-03-22T21:27:23+0000	"#aovivo estou agora na universidade de brasilia junto com sonia bone guajajara e as companheiras do psol em mais um encontro com o povo do distrito federal. #vamos"	99	0	36
398845206932703_1001222033361681	2018-03-22T18:00:00+0000	"querem implementar no brasil um ajuste que nao deu certo em nenhum outro lugar do mundo, porque aqui daria?  -- confira na integra minha entrevista para a tv folha: http://bit.ly/2ftyrsx  #vamoscomboulos #vamos2018"	145	0	36
398845206932703_1743942732320393	2018-03-22T15:38:06+0000	"voces sabem mesmo o que e uma fake news? como elas sao criadas? a que interesses servem? assista ao video do jean wyllys e entenda!"	70	1	30
398845206932703_1000542520096299	2018-03-20T23:04:25+0000	"mesmo com temporal que parou a cidade milhares de pessoas se reunem no vao do masp para o ato marielle vive - sp!"	249	0	74
398845206932703_1000027336814484	2018-03-20T19:00:00+0000	"7,2 milhoes de imoveis vazios e mais de 6 milhoes de pessoas sem teto. voce acha isso justo?  -- confira na integra minha entrevista para a tv folha: http://bit.ly/2ftyrsx   #vamoscomboulos #vamos2018"	552	2	157
398845206932703_1000403586776859	2018-03-20T17:32:15+0000	"#aovivo em apoio aos professores e contra o sampaprev, que quer acabar com a aposentadoria dos servidores publicos!"	597	3	234
398845206932703_1000041560146395	2018-03-20T17:00:00+0000	"extrema-esquerda? eu defendo a igualdade social. -- confira na integra minha entrevista para a tv folha: http://bit.ly/2ftyrsx  #vamoscomboulos #vamos2018"	436	1	102
398845206932703_999941266823091	2018-03-20T13:00:00+0000	"ter diferencas politicas nao significa ser convivente com a injustica -- confira na integra minha entrevista para a tv folha: http://bit.ly/2ftyrsx  #vamoscomboulos #vamos2018"	235	2	47
398845206932703_999411400209411	2018-03-19T11:00:01+0000	"a melhor coisa que podemos fazer pela marielle e levar adiante sua luta. quando alguem morre, se vai, as pessoas costumam fazer um minuto de silencio. com os lutadores, a gente faz diferente: em memoria de marielle, um minuto de aplausos! #mariellepresente"	303	0	48
398845206932703_999279550222596	2018-03-18T22:45:50+0000	"na ultima semana dei entrevista para a tv folha e falei sobre diversos temas. confira o resumo da conversa, e assista na integra em http://bit.ly/2ftyrsx #vamoscomboulos"	558	3	163
398845206932703_999194263564458	2018-03-18T20:28:01+0000	"acompanhem a assembleia da vitoria da ocupacao povo sem medo! depois de mais de 6 meses de resistencia, a maior ocupacao urbana da america latina que reune mais de 8 mil familias atingiu o seu objetivo.  os trabalhadores e trabalhadoras conquistaram 4 terrenos para construcao de suas moradias! #aovivo"	1730	28	1571
398845206932703_996672210483330	2018-03-14T20:53:23+0000	"participo agora do debate \"desafios da esquerda e a luta pela unidade num futuro incerto\" com boaventura de sousa santos, luiz dulci e gerardo caetano no forum social mundial, em salvador #aovivo"	288	3	130
398845206932703_996630037154214	2018-03-14T19:52:51+0000	"bombas, violencia e desrespeito na camara de vereadores de sao paulo. e assim que vamos tratar os professores que educam nossos filhos?"	1339	88	635
398845206932703_996585717158646	2018-03-14T18:30:41+0000	"todo apoio a greve dos professores municipais de sao paulo! sua luta tenta impedir a privatizacao de suas aposentadorias, pelo projeto sampaprev. veja no video o absurdo da repressao policial que acontece nesse momento, com pessoas feridas e desmaiadas. e assim que vamos tratar os professores que educam nossos filhos?"	602	130	945
398845206932703_995603573923527	2018-03-13T14:26:36+0000	"como nasceu nossa pre-candidatura  3 de marco de 2018: conferencia cidada, um encontro que nasceu historico.  movimentos sociais e sociedade civil organizada se unem com todas suas cores e decidem nao mais esperar da politica o encantamento que ela perdeu. e hora de ocupar a politica! vamos juntos com guilherme boulos e sonia bone guajajara.  #vamos2018"	1082	4	239
398845206932703_995043297312888	2018-03-12T12:01:50+0000	"gregorio duvivier: \"sou muito fa dessa dupla, guilherme boulos e sonia guajajara. acho que deu match. muito potente, os dois sao liderancas muito legitimas..\" #vamos2018"	682	3	116
398845206932703_993984010752150	2018-03-11T19:47:00+0000	"\"a pre-candidatura de guilherme e de sonia e a representacao concreta de uma campanha de enfrentamento a esse sistema economico que quer naturalizar a opressao.\" glauber braga esta junto com a gente sem medo de mudar o brasil. #vamos2018"	200	0	21
398845206932703_993985280752023	2018-03-11T17:00:00+0000	"\"o brasil vai se apresentar ao brasil.\" um salve do edmilson rodrigues para nossa chapa de pre-candidatura. #vamos2018"	121	0	13
398845206932703_993986974085187	2018-03-11T15:00:00+0000	"\"momento fundamental da historia politica brasileira\" marcelo freixo parabeniza a nossa vitoria de ontem na conferencia eleitoral do psol 50. #vamos2018"	394	1	54
398845206932703_994072154076669	2018-03-11T14:00:00+0000	"\"essa mare cheia que desagua na candidatura de guilherme boulos para presidente da republica, com a co-presidenta sonia bone guajajara , simbolizando a unidade da cidade e do campo, a resistencia de 500 anos desse povo que e mais sabio do que quem o pretendeu governar ate agora.\"  chico alencar tambem sauda nossa jornada para este ano. #vamos2018"	208	0	33
398845206932703_994053627411855	2018-03-11T00:32:32+0000	"nossa pre-candidatura no jornal nacional dessa noite: \"o estado e na verdade um robin hood ao contrario: tira dos pobres por um sistema tributario injusto e da aos ricos com uma taxa de juros absurda, por meio do sistema da divida publica\" #vamos2018"	3121	26	1893
398845206932703_993989897418228	2018-03-10T23:35:36+0000	"\"uma candidatura historica de uma alianca de um partido politico com varios os movimentos sociais. uma indigena de co-presidenta e um lider sem teto candidato a presidente.\"  vamos juntos, sem medo de mudar o brasil tarcisio motta!  #vamos2018"	248	1	33
398845206932703_993991064084778	2018-03-10T23:10:46+0000	"\"a ousadia de mostrar que e possivel associar partidos politicos e movimentos de baixo pra cima\"  ivan valente tambem esteve hoje na conferencia eleitoral do psol 50 e demonstrou seu apoio a nossa pre candidatura. #vamos2018"	110	2	14
398845206932703_993984440752107	2018-03-10T22:38:54+0000	"\"essa pre-candidatura do guilherme boulos com a sonia bone guajajara representa o coracao popular pulsando nesse momento\".  valeu aurea carolina! #vamos2018"	115	1	9
398845206932703_993788574105027	2018-03-10T19:15:31+0000	"mais uma bobagem que espalham por ai: \"voce nao e sem teto e ta no movimento dos sem teto!\" #havanaconnection #vamos2018"	1558	4	1980
398845206932703_993353370815214	2018-03-09T22:29:52+0000	"a atriz brasileira mundialmente reconhecida sonia braga mandou tambem seu recado aos trabalhadores e trabalhadoras sem teto, como entusiasta dos desafios que assumimos em 2018! #vamos2018"	425	1	65
398845206932703_993259960824555	2018-03-09T20:36:19+0000	"a democracia nao chegou na periferia e nos precisamos fazer chegar! confira como foi o discurso de dennis oliveira, professor da usp e lideranca de comunidade quilombola, na conferencia cidada. #vamos2018"	152	0	19
398845206932703_993257390824812	2018-03-09T19:08:29+0000	"ha um ano estavamos encerrando a #ocupapaulista com uma vitoria do movimento. junto a artistas, ativistas, estudantes, professores, populares e apoiadores, mostramos apos 22 de ocupacao na maior avenida do pais que e possivel vencer! hoje, estamos mais uma vez juntos, prontos para enfrentar os desafios de 2018.  video: midia ninja  #vamos2018 #ocupapaulista #memoriasdeluta"	200	1	48
398845206932703_993196790830872	2018-03-09T17:52:19+0000	"participo agora do havana connection #aovivo com jean wyllys, laura capriglione e leonardo sakamoto"	654	23	272
398845206932703_993014000849151	2018-03-09T13:14:40+0000	"resposta a jair bolsonaro: \"se tem algum criminoso nessa campanha nao sou eu, e voce!\""	5832	245	37421
398845206932703_1089214291231900	2018-03-08T17:26:56+0000	"ta no ar o primeiro episodio do manas da lona preta! programa que vai ouvir e apresentar as manas, minas e monas que constroem a luta dos sem teto. conversamos com andreia, ediane e tati, algumas das mulheres comandantas da luta na ocupacao mtst - povo sem medo sao bernardo. https://www.facebook.com/manasdalonapreta/"	84	0	30
398845206932703_1096533923838085	2018-03-08T15:53:44+0000	"\"e muito poder ter uma mulher indigena e um sem teto indo a frente com uma construcao coletiva, enraizada nas lutas populares, pra fazer as transformacoes no nosso cotidiano.\" aurea carolina, vereadora eleita de belo horizonte, prestou seu apoio na conferencia cidada, no ultimo sabado em sao paulo.  #vamos2018"	75	2	21
398845206932703_991933444290540	2018-03-07T17:53:41+0000	"\"nos somos o povo, do povao, das cidades e das florestas, trabalhadores e indigenas. fazemos parte da base de uma piramide a cada dia mais desigual e injusta. somos o povo, indios, negro e brancos, com todos os sotaques de um pais tao diverso como o nosso. um brasil enorme, rico mas que ha seculos e guiado por uma minoria que nos expulsa de nossas terras e nos empurra para periferias e presidios, para as beiras de estradas e favelas.\"   y'wara guajajara e maria das dores, representaram os indigenas e sem teto na conferencia cidada no ultimo sabado. #vamos2018"	97	0	29
398845206932703_991846114299273	2018-03-07T15:19:44+0000	"guilherme boulos quer matar pessoas? valeu por esclarecer, gregorio duvivier.  #vamos2018"	11487	99	9237
398845206932703_991273994356485	2018-03-06T17:13:11+0000	"\"esse e o momento de construirmos aliancas, esse momento representa resistencia de um povo, resistencia dos corpos. e o nosso momento!\", leandrinha du art na conferencia cidada. #vamos2018"	68	2	6
398845206932703_991262027691015	2018-03-06T16:45:55+0000	"\"por que sera que nosso transporte coletivo e de quinta, ineficiente, caro e inacessivel? por que 5 horas em um transporte que nao funciona? porque nao temos hoje uma cidade para todos\", raquel rolnik na conferencia cidada. #vamos2018"	168	0	70
398845206932703_991251271025424	2018-03-06T16:25:50+0000	"\"nao queremos mais ser excluidos desse sistema, queremos estar la e nao vamos mais pedir licenca para entrar.\" ana julia ribeiro e daniel cara durante a conferencia cidada. #vamos2018"	75	0	16
398845206932703_990661694417715	2018-03-05T17:28:09+0000	"#aovivo guilherme boulos do mtst se filia nesse momento ao psol em sao paulo."	617	10	162
398845206932703_1093781410780003	2018-03-05T00:16:48+0000	"\"teremos uma candidatura com dois representantes dos movimentos sociais, guilherme boulos e sonia guajajara. estaremos em fileira ajudando a construir o programa, implementa-lo e a fiscaliza-lo.\"  jupiara castro, em uma fala inspirada ontem na conferencia cidada. #vamos2018"	209	0	38
398845206932703_1093732694118208	2018-03-04T23:13:13+0000	"\"precisamos votar numa camera federal que nos represente, que seja positiva, leve nossa pauta em frente. o novo que temos que botar na politica tem que ta enraizado na luta do nosso povo, defendendo as pessoas que tao sem teto, sem territorio, sem dignidade.\" a grande laerte na conferencia cidada, que aconteceu ontem em sao paulo. #vamos2018"	95	0	11
398845206932703_1093690644122413	2018-03-04T22:23:26+0000	"\"e guilherme boulos na porra do bagulho!\" ferrez escritor marcou presenca na conferencia cidada, ontem em sp, e mostrou a periferia presente na casa das caldeiras. #vamos2018"	216	0	70
398845206932703_989488967868321	2018-03-03T23:53:12+0000	"ao vivo na conferencia cidada. #vamos2018"	372	4	150
398845206932703_981372232013328	2018-02-19T02:08:34+0000	"escandaloso! general do exercito da reserva defende eliminacao de pessoas e imunidade para os soldados que matarem durante a intervencao no rio de janeiro. #intervencaonao"	202	225	224
398845206932703_979943985489486	2018-02-16T20:05:21+0000	"intervencao no rio de janeiro e grave  a solucao para a violencia nao e militarizar mais. isso vai apenas aumentar a criminalizacao da pobreza. alem disso, o sinal de que o exercito e a solucao para os problemas sociais e politicos nos remete a tempos sombrios. #intervencaonao"	6150	320	13977
398845206932703_971568696327015	2018-02-02T21:24:02+0000	"bloco do povo sem medo agora em sp!"	224	0	24
398845206932703_970277559789462	2018-01-31T16:45:00+0000	"quem sao mesmo os extremistas?  num momento em que os donos do poder parecem querer incendiar o pais, sem medir as consequencias, e oportuno questionar quem sao os extremistas no brasil hoje. reproduzo aqui video publicado pela pagina quebrando o tabu em resposta a acusacoes de \"extremismo\"."	60314	535	104297
398845206932703_966258750191343	2018-01-25T01:02:29+0000	"golpe atras de golpe! #povosemmedo"	1994	8	576
398845206932703_1684952014876456	2018-01-24T19:43:51+0000	"ponte do socorro vai ter resistencia!  povo fecha ponte do socorro em defesa da democracia e contra a injusta condenacao de lula pelo trf-4. #povosemmedo"	776	6	153
398845206932703_1684909738214017	2018-01-24T18:50:18+0000	"dutra parada! vai ter resistencia!  povo fecha rodovia presidente dutra em defesa da democracia e contra a injusta condenacao de lula pelo trf-4. #povosemmedo"	1459	14	1338
398845206932703_1684899894881668	2018-01-24T18:37:38+0000	"vai ter resistencia! povo fecha rodovia regis bitencourt em defesa da democracia e contra a injusta condenacao de lula pelo trf-4. #povosemmedo"	585	4	116
398845206932703_1684755704896087	2018-01-24T15:21:32+0000	"depoimento para a tvt no evento do forum social mundial  \"acao global anti-davos\" realizado em porto alegre no dia de ontem. a defesa do direito do ex-presidente lula ser candidato e a defesa da democracia. #povosemmedo   imagens: tvt"	106	0	35
398845206932703_962807500536468	2018-01-19T14:41:34+0000	"dia 24 e dia de enfrentar a ditadura de toga!  minha fala de solidariedade ao ex-presidente lula ontem em sao paulo."	748	1	605
398845206932703_961306037353281	2018-01-16T20:52:47+0000	"quando juizes fazem politica nao se pode falar em democracia."	366	3	219
