post_id	date	message	num_likes	num_angry	num_shares
1216504185136925_274070369895346	2018-09-29T01:00:53+0000	"com a pec do teto, sera impossivel retomar o investimento na educacao federal. precisamos colocar toda a nossa forca na revogacao dessa lei absurda. #ciro12 #ciropresidente #pergunteaociro12"	1421	18	454
1216504185136925_1856180827835921	2018-09-28T20:03:03+0000	"domingo tem ciro no penultimo debate antes do primeiro turno. assista e nos ajude a espalhar a noticia! #cironarecord #debaterecord #ciro12"	4888	10	1912
1216504185136925_1918998271743191	2018-09-28T21:01:07+0000	"com seu voto vamos chegar ao segundo turno e colocar um fim nessa polarizacao que esta machucando nosso pais. #ciro12 #ciropresidente"	15023	193	12006
1216504185136925_2045419902180928	2018-09-28T16:31:21+0000	"o brasil esta destruindo o seu parque industrial. como reverter esse quadro e fazer o pais gerar mais empregos? veja a resposta de ciro. #ciro12 #ciropresidente #pergunteaociro12"	1402	5	357
1216504185136925_2406109722948898	2018-09-28T16:00:01+0000	"muito obrigado pelo apoio, querida ana de hollanda. pode contar comigo. juntos, a gente vai transformar o brasil. #ciro12 #ciropresidente"	1262	4	251
1216504185136925_316461218904757	2018-09-28T14:46:07+0000	"todos e todas por um brasil de paz, respeito as  diferencas e tolerancia."	45304	651	57696
1216504185136925_164288924494305	2018-09-28T13:41:53+0000	"minha proposta e clara: tirar o seu nome do spc e gerar 2 milhoes de empregos ja no 1o ano de governo. nome limpo, trabalho e salario! #ciro12 #ciropresidente"	5197	51	1107
1216504185136925_1909306762522277	2018-09-28T10:30:01+0000	"obrigado pelo apoio, querido amigo alessandro molon. e de pessoas como voce que eu quero ao meu lado para defender o brasil dos graves ataques que o nosso povo tem sofrido. #ciro12 #ciropresidente"	5668	6	2886
1216504185136925_1114755962013645	2018-09-28T01:01:00+0000	"sem professor estimulado, respeitado e prestigiado, e impossivel fazer uma educacao de qualidade. #ciro12 #ciropresidente #pergunteaociro12"	1682	8	610
1216504185136925_1855100751277262	2018-09-28T00:01:29+0000	"gente querida de manaus. nesse sabado, minha equipe vai estar por ai para ouvir ideias e sugestoes para o nosso plano de governo. com a sua colaboracao, nos vamos mudar esse pais. participe com todo seu entusiasmo: https://www.facebook.com/events/2709156092443290. #ciro12 #ciropresidente"	1107	3	111
1216504185136925_1855081737945830	2018-09-27T23:36:59+0000	"as maes e os pais brasileiros precisam de trabalho digno, seus filhos precisam de educacao de qualidade e de tempo integral. ciro tem experiencia e sabe como fazer essa equacao dar certo. #ciro12 #ciropresidente  conheca as propostas de ciro:   plano emergencial de empregos, clique aqui https://bit.ly/2mq6ogo. creche em tempo integral, clique aqui https://bit.ly/2xcjujc. escola profissionalizante de tempo integral, clique aqui https://bit.ly/2nmriuc."	2108	4	771
1216504185136925_234934613840751	2018-09-27T23:31:03+0000	"ciro vai garantir consulta com especialistas e exames de imagem para quem nao possui plano de saude atraves das policlinicas. serao 617 em todo o pais. conheca os detalhes da proposta em https://www.cirogomes.com.br/propostas/policlinicas"	3271	1	1791
1216504185136925_296577754492449	2018-09-27T23:00:01+0000	"muito obrigado, meu querido ney matogrosso! que a sua arte nos sirva de inspiracao para gente mudar esse pais. #ciro12 #ciropresidente"	8052	7	2777
1216504185136925_166287584286264	2018-09-27T21:26:55+0000	"aumento de imposto de renda para os pobres, recriacao da cpmf, ser contra o 13o e o adicional de ferias. qual sera a proxima revelacao da campanha daquele?"	13292	270	22037
1216504185136925_243552459653677	2018-09-27T19:53:03+0000	"as maes brasileiras, principalmente as quase 30 milhoes que chefiam sozinhas seus lares, merecem ir a luta em paz, sabendo que seus bebes e seus filhos adolescentes estao bem cuidados. e por isso que eu vou levar creche e escola em tempo integral a todo pais."	16556	24	11182
1216504185136925_535534036908058	2018-09-27T17:39:59+0000	"meu compromisso e levar escola profissionalizante em tempo integral para nossa juventude. no 3o ano todos os jovens terao estagio pago pelo governo. isso nao e um sonho! ja acontece em 1 de cada 3 escolas no ceara. para saber mais sobre a proposta, acesse: https://www.cirogomes.com.br/propostas/escola-profissionalizante-de-tempo-integral/"	2731	0	1283
1216504185136925_642937229433726	2018-09-27T19:00:26+0000	"obrigado pelo apoio, caco ciocler! junte-se a nos voce tambem. vamos juntos mudar o brasil. #ciro12 #ciropresidente"	8790	11	4462
1216504185136925_579840859119245	2018-09-27T14:27:39+0000	"vou investir em escola profissionalizante de tempo integral para o ensino medio, oferecendo cursos de acordo com o mercado de trabalho, necessidade de cada regiao e estagio pago pelo governo. veja os detalhes: http://bit.ly/ciroescola . #ciro12"	2252	2	809
1216504185136925_559638757801784	2018-09-27T11:01:55+0000	"ciro ja assumiu esse compromisso e volta a repetir: em nosso governo, metade dos ministerios serao comandados por mulheres. #ciro12 #ciropresidente #pergunteaociro12"	1455	0	391
1216504185136925_284930758782509	2018-09-27T01:15:00+0000	"fazemos parte da turma que esta do lado do amor. #ciro12 #ciropresidente"	3874	2	2351
1216504185136925_1853579591429378	2018-09-26T23:22:52+0000	"obrigado, meu querido moraes moreira. sigamos no embalo da cancao, vamos juntos mudar o brasil. #ciro12 #ciropresidente"	5894	4	2373
1216504185136925_1629964677109702	2018-09-26T23:01:01+0000	"turma querida da minha amada minas gerais. amanha, eu estaria ai com voces, mas os medicos pediram e vou ter que adiar nosso encontro. ate o fim da campanha, vou fazer de tudo para dar um pulo ai e dar um abraco nas minhas irmas e nos meus irmaos mineiros que estao me ajudando a mudar o brasil. beijos. #ciro12 #ciropresidente"	2393	4	155
1216504185136925_1853555814765089	2018-09-26T22:57:09+0000	"#debatesbt #uolnasurnas #ciro12"	8772	3	5749
1216504185136925_1853474664773204	2018-09-26T21:31:15+0000	"#debatesbt #uolnasurnas #ciro12"	4468	4	1518
1216504185136925_335234900381226	2018-09-26T20:46:19+0000	"ta comecando agora, 17h45! #debatesbt #uolnasurnas #ciro12"	1254	3	103
1216504185136925_582902035460041	2018-09-26T19:47:37+0000	"com a lataria consertada , a caminho do debate! liga la, a partir das 17h45. #debatesbt #uolnasurnas #ciro12"	10078	18	3607
1216504185136925_1853312638122740	2018-09-26T18:43:03+0000	"brasilia-df #ciro12 #todoscomciro #todaquartae12"	3765	3	368
1216504185136925_2171685562905663	2018-09-26T18:01:09+0000	"para combater o narcotrafico e as faccoes criminosas e preciso coragem e inteligencia. sao esses bandidos de alta periculosidade que, com a conivencia das autoridades, tem assombrado o nosso povo. derrota-los sera a nossa prioridade numero um em seguranca. #ciro12 #ciropresidente #pergunteaociro12"	800	0	285
1216504185136925_1853109254809745	2018-09-26T15:15:09+0000	"nosso cirao esta muito grato pelo apoio da classe artistica. e quem vai votar nele tem um porque: propostas e preparo. #ciropresidente #ciro12"	9298	7	4504
1216504185136925_1014766388702340	2018-09-26T11:01:23+0000	"vamos fazer tudo que estiver ao nosso alcance para estimular o uso de energia solar, eolica e outras energias sustentaveis. #ciro12 #ciropresidente #pergunteaociro12"	1055	2	298
1216504185136925_341039493308593	2018-09-26T01:01:11+0000	"conheca algumas das propostas de ciro para a saude. #ciro12 #ciropresidente #pergunteaociro12"	1533	4	619
1216504185136925_1852268781560459	2018-09-26T00:04:00+0000	"nota  ciro gomes deu entrada no fim da tarde desta terca-feira (25/09) no hospital sirio libanes. apos exames passou por um procedimento de cauterizacao de vasos da prostata. o procedimento foi realizado com sucesso pelo medico urologista miguel srougi. por ser um procedimento simples, ciro gomes podera retornar as suas atividades o mais breve possivel."	6770	0	449
1216504185136925_1852019424918728	2018-09-25T19:40:07+0000	"muito emocionado com o apoio desse grande artista e conterraneo. autor da celebre \"pavao mysterioso\". obrigado, ednardo! vamos juntos reconstruir esse pais!"	1656	1	157
1216504185136925_283339142274509	2018-09-25T19:31:05+0000	"poeta rodolfo da o recado! ainda temos 12 dias pela frente. nos temos um projeto para o brasil voltar a ser feliz e confiamos nessa mensagem. #ciro12 #ciropresidente"	3169	4	1421
1216504185136925_2148191548778965	2018-09-25T23:00:51+0000	"agora e ciro12 para mudar o brasil! solta o som, dj! #ciro12 #ciropresidente"	6982	10	4379
1216504185136925_1851953098258694	2018-09-25T18:25:11+0000	"amanha, todos ligados no sbt. tem ciro em mais um debate. espalhe a noticia. #ciro12 #debatesbt #uolnasurnas"	3891	1	1260
1216504185136925_509418946241289	2018-09-25T18:01:04+0000	"a mortalidade infantil voltou a crescer e assustar os brasileiros. ciro sabe como combater essa tragedia. quando governador, ciro foi premiado pelo unicef pela diminuicao da mortalidade infantil no ceara. #ciro12 #ciropresidente #pergunteaociro12"	917	0	268
1216504185136925_272033340102804	2018-09-25T12:52:26+0000	"eduardo sterblitch ja disse: e ciro hein? obrigado pelo apoio, querido. um beijo! "	6483	3	2605
1216504185136925_162627994649299	2018-09-25T11:45:09+0000	"faltam 12 dias pra votar ciro 12! vamos mudar o brasil "	7046	10	6740
1216504185136925_240412729975197	2018-09-25T11:01:39+0000	"a escola profissionalizante de tempo integral para o ensino medio vai tratar o jovem com o respeito que ele merece e ainda prepara-lo para uma profissao. conheca a proposta completa em www.cirogomes.com.br/propostas/escola-profissionalizante-de-tempo-integral. #ciro12 #ciropresidente #pergunteaociro12"	1964	0	654
1216504185136925_1437763072992676	2018-09-25T01:01:01+0000	"as pessoas estao assustadas, mas elas precisam saber que existe uma alternativa de mudanca segura para o brasil. ciro e ficha limpa, experiente e tem o preparo e a coragem necessaria para guiar o pais nesse momento. #ciro12 #ciropresidente #pergunteaociro12"	4512	5	1678
1216504185136925_244037489613140	2018-09-24T22:34:56+0000	"joanna maranhao e tulio gadelha fazem parte da juventude tao guerreira de recife. o povo de pernambuco quer uniao e mudancas. entao, meu meu irmao, e ciro 12!"	4359	2	1486
1216504185136925_2649865295246947	2018-09-24T21:31:09+0000	"a juventude do rio ja decidiu! quer ciro gomes presidente do brasil!! #ciro12 #ciropresidente"	2329	2	639
1216504185136925_2151134991807699	2018-09-24T15:37:42+0000	"ciro foi muito bem recebido em madureira, no rio de janeiro. ao lado de pedro fernandes, candidato a governador, e de jose bonifacio, candidato ao senado, cirao falou sobre a base de seu plano: garantir trabalho para pais e maes e escola e creche de qualidade para as criancas.  fotos: leo canabarro"	1611	1	214
1216504185136925_287647148508234	2018-09-24T11:02:51+0000	"cultura e sinonimo de identidade nacional e um dos nossos bens mais preciosos. nosso governo vai tratar a cultura do povo brasileiro com o incentivo e a reverencia que ela merece. #ciro12 #ciropresidente #pergunteaociro12"	1677	5	385
1216504185136925_237588773586191	2018-09-24T01:42:31+0000	"nosso voto vai decidir o destino do pais. o brasil precisa mudar.   meu muito obrigado a turma de timon, no maranhao, que preparou esse video e que esta junto nessa mudanca. #ciro12 #ciropresidente"	7353	5	4885
1216504185136925_239326480073396	2018-09-24T01:01:33+0000	"ciro foi pedido em casamento enquanto respondia perguntas na sede do twitter. veja a resposta do nosso candidato. #ciro12 #ciropresidente #pergunteaociro12"	2341	1	240
1216504185136925_973324136207698	2018-09-23T23:55:57+0000	"o povo da minha amada fortaleza reunido para um show e de repente comecaram a gritar \"ciro, ciro, ciro\". e de arrepiar. obrigado, fortaleza  #ciro12 #ciropresidente"	10961	6	4351
1216504185136925_283534525591342	2018-09-23T23:30:49+0000	"como reduzir nossas profundas desigualdades sociais? ciro tem o caminho. #ciropresidente #ciro12"	3987	2	1624
1216504185136925_236061740592202	2018-09-23T23:16:11+0000	"mossoro, no rio grande do norte tambem quer mudanca! brasil pra frente, ciro presidente!  #ciro12"	2160	1	526
1216504185136925_2205409319742947	2018-09-23T20:51:34+0000	"pernambucano, eu sou valente, eu quero ciro presidente!  "	3525	7	1196
1216504185136925_251479122225317	2018-09-23T18:16:26+0000	"ciro #aovivo no recife! juventude na luta por um brasil melhor!  compartilhe!"	3994	14	1514
1216504185136925_527405184390171	2018-09-23T18:08:34+0000	"na luta contra o odio. amor gera...amor. assim e a campanha de ciro! "	3704	4	955
1216504185136925_2238527906382565	2018-09-23T17:45:58+0000	"teresina tambem quer mudar! vamos juntos  e ciro 12 "	3952	6	1256
1216504185136925_1996486013705439	2018-09-23T16:14:46+0000	"brasil pra frente ciro presidente!  #ciro12"	1693	1	411
1216504185136925_580013469085050	2018-09-23T12:02:42+0000	"waldonys e ciro de ponta-cabeca e o coracao a mil! #ciro12 #ciropresidente"	3843	5	1284
1216504185136925_280891215970075	2018-09-23T11:01:57+0000	"imagina a beyonce na posse de ciro? a hipotese foi levantada pela nossa querida joanna maranhao. #ciro12 #ciropresidente #pergunteaociro12"	2107	4	171
1216504185136925_538042416608763	2018-09-23T05:24:52+0000	"este sabado amanheci em belo horizonte (mg), fui a salvador (ba), estive na cidade de joao camara (rn) e cheguei na madrugada deste domingo em teresina (pi). a alegria desta turma as 2h da manha e contagiante e me faz lutar ainda mais pelo brasil!  #ciro12"	2457	4	580
1216504185136925_326567124573540	2018-09-23T03:38:12+0000	"ao lado de carlos eduardo, candidato ao governo de rio grande do norte, ciro gomes e recebido por milhares de pessoas na cidade de joao camara (rn). cada vez mais gente com ciro!"	2217	4	494
1216504185136925_302635650466311	2018-09-23T01:38:49+0000	"ciro gomes #aovivo em joao camara (rn). junto com carlos eduardo, candidato ao governo do rio grande do norte."	4411	50	1654
1216504185136925_519797735164836	2018-09-23T01:00:59+0000	"tem candidato que muda a postura dependendo do publico, mas que agora resolveu ser explicito: vai aumentar impostos para os mais pobres e diminuir para os mais ricos. ciro vai fazer o contrario: diminuir para os mais pobres e a classe media e aumentar para os mais ricos."	4428	11	1780
1216504185136925_343338906242176	2018-09-22T21:15:33+0000	"ciro responde ao jornal o globo."	28196	63	21998
1216504185136925_297547027711625	2018-09-22T20:31:10+0000	"hoje, 40 milhoes de irmas e irmaos brasileiros dependem do bolsa familia para fazer as refeicoes basicas. e evidente que nos precisamos manter e aperfeicoar esse programa. #ciro12 #ciropresidente  #pergunteaociro12"	4329	4	1653
1216504185136925_2203863826354833	2018-09-22T18:54:11+0000	"minas tambem esta com ciro!   eu sou mineiro, eu falo uai, eu quero ciro presidente ninguem mais!  #ciro12 #ciropresidente"	3983	2	1482
1216504185136925_2210797655831943	2018-09-22T16:20:45+0000	"ciro vai implantar policlinicas em todo o brasil para garantir consulta com medico especialista e exames de imagem. tudo com hora marcada e sem pagar nada. as policlinicas ja funcionam assim no ceara, onde foram criadas a partir de 2010. veja o passo a passo de como ciro vai fazer. e para conhecer outras propostas de ciro, acesse: www.cirogomes.com.br #ciro12 #ciropresidente"	2370	1	996
1216504185136925_287251881998566	2018-09-22T12:30:00+0000	"veja o recado que ciro tem pra voce! saiba agora o que fazer daqui ate o dia 07 de outubro! acesse: https://centraldamassa.com/ #ciro12 #ciropresidente"	2737	1	658
1216504185136925_337682146788810	2018-09-22T11:29:00+0000	"obrigado, goiania! revolta e violencia nunca permitiram que nenhuma nacao do mundo resolvesse os seus problemas. o brasil precisa de projeto de governo. #ciro12 #ciropresidente"	3774	2	1244
1216504185136925_1170685573073884	2018-09-22T11:22:04+0000	"pinda, obrigado pela recepcao! reitero meu compromisso de estimular a industria nacional e voltar a gerar empregos para o nosso povo. #ciro12 #ciropresidente"	1246	2	259
1216504185136925_287352201869918	2018-09-22T11:15:31+0000	""	3387	4	831
1216504185136925_1846049795515691	2018-09-21T21:27:10+0000	"marque os amigos, vizinhos, colegas, conhecidos, crushes, contatinhos. comente os seus motivos e vamos juntos mudar o brasil! #ciro12 #ciropresidente "	4269	1	1244
1216504185136925_1845970458856958	2018-09-21T19:45:16+0000	"me comprometi hoje com o unicef em dar prioridade absoluta aos direitos e ao bem-estar das criancas e dos adolescentes. veja mais no meu plano: www.cirogomes.com.br  fotos: leo canabarro"	6395	1	1613
1216504185136925_1845944422192895	2018-09-21T19:18:41+0000	"ciro e recebido no nucleo bandeirante (df) com muita festa! uma multidao que quer mudanca acompanhou nosso cirao. durante o percurso, ele esteve ao lado do candidato a reeleicao pelo governo do distrito federal, rodrigo rollemberg. #ciropresidente #ciro12  fotos: leo canabarro"	1702	3	142
1216504185136925_1845942942193043	2018-09-21T19:17:18+0000	"quando ciro criou o programa nome limpo, ele pensou na economia do brasil e na geracao de empregos. quem esta com o nome no spc tem mais dificuldade de arranjar emprego. mas com o nome limpo, as pessoas podem voltar a trabalhar e ganhar um salario.   com salario, voltam a comprar, o comercio vende mais, a industria produz mais e novos empregos sao criados. e aquela historia: com emprego, a maior parte dos problemas se resolve!   conheca o programa nome limpo: clique aqui https://bit.ly/cirospc.   #ciro12 #ciropresidente"	1382	2	225
1216504185136925_327103308057180	2018-09-21T18:28:51+0000	"nem a, nem b, e c de ciro! #ciro12 #ciropresidente"	6795	12	4043
1216504185136925_2071505209827070	2018-09-21T17:23:28+0000	"tenho afirmado ha muito tempo que, com a venda para a boeing, querem fechar a embraer, empresa de aviacao brasileira e uma das mais importantes do mundo. nao vamos permitir!  veja materia nos comentarios."	10683	19	9243
1216504185136925_1846235835497087	2018-09-21T20:45:15+0000	"quatro das maiores centrais sindicais do brasil, que representam nacionalmente mais de 3 mil sindicatos e 10 milhoes de trabalhadores, declaram apoio a ciro! #ciro12 #ciropresidente"	2944	1	1112
1216504185136925_1844882782299059	2018-09-20T22:42:40+0000	"entre no evento oficial, confirme presenca e compareca nos locais oficiais de #todaquartae12: https://bit.ly/todaquartaeciro.  marque suas fotos e videos com as hashtags #todoscomciro e #quartae12 para todo mundo conseguir encontrar, divulgar e compartilhar!"	3765	3	368
1216504185136925_1844639185656752	2018-09-20T18:01:37+0000	"e hoje a noite! ciro no debate da cnbb. assista pela tv aparecida ou pela tv cultura. acompanhe aqui pela nossa pagina. #debatecnbb #debateaparecida #ciro12"	2356	0	776
1216504185136925_817274558643042	2018-09-20T15:15:33+0000	"menos por politica, que me honra muito, e mais por amor. muito obrigado patricia!"	17451	19	6536
1216504185136925_1843653719088632	2018-09-20T01:30:04+0000	"nesta quinta, tem ciro em mais um debate entre presidenciaveis. desta vez, o encontro sera organizado pela confederacao nacional de bispos do brasil (cnbb), com transmissao pela tv aparecida e tv cultura. convide seus amigos para assistir! #ciro12 #debatecnbb"	2453	5	613
1216504185136925_1843569182430419	2018-09-19T23:38:48+0000	"entre no evento oficial, confirme presenca e compareca nos locais oficiais de #todaquartae12: https://bit.ly/todaquartaeciro.  marque suas fotos e videos com as hashtags #todoscomciro e #quartae12 para todo mundo conseguir encontrar, divulgar e compartilhar!"	3765	3	368
1216504185136925_242942549725180	2018-09-19T21:37:27+0000	"centrais sindicais tambem estao conosco! dirigentes da forca sindical, uniao geral dos trabalhadores (ugt), nova central sindical e central dos sindicatos brasileiros (csb) anunciaram o apoio ao nosso cirao. toda a classe trabalhadora quer mudar! mude! #ciro12"	3462	5	1161
1216504185136925_266267127344750	2018-09-19T19:33:26+0000	"#aovivo recebo apoio dos trabalhadores e trabalhadoras da csb, ugt, forca sindical, ctb e nova central sindical."	3794	18	1207
1216504185136925_1600544656716680	2018-09-19T18:50:06+0000	"quero agradecer a todo mundo que esta na luta com a gente para mudar o brasil. e fazer uma pergunta: voces lembram das pesquisas eleitorais de 2014?  #ciro12 #ciropresidente"	11403	16	8295
1216504185136925_1843272942460043	2018-09-19T18:10:01+0000	"hoje a partir das 20h tem ciro na sede do @twitterbrasil. envie suas perguntas com a hastag #pergunteaociro12  compartilhe, divulgue e vamos com #ciro12."	902	2	110
1216504185136925_1843056949148309	2018-09-19T14:42:05+0000	"mostre que voce tambem e #ciro12. vamos juntos mudar o brasil!"	1977	2	120
1216504185136925_1842186842568653	2018-09-18T23:26:51+0000	"o compromisso de ciro e levar a escola profissionalizante de tempo integral para o ensino medio de todo o brasil, selecionando as profissoes de acordo com o mercado de trabalho e a necessidade de cada regiao.   ciro vai iniciar essas escolas pelos bairros mais carentes das grandes cidades, onde o abandono escolar no ensino medio e maior. e, aos poucos, mudaremos a realidade dos jovens de todo o brasil.   conheca mais sobre este nosso programa: clique aqui http://bit.ly/ciroescola.   #ciro12 #ciropresidente"	4410	5	1565
1216504185136925_1375088102626185	2018-09-18T19:40:02+0000	"nao deixe de confirmar presenca no evento oficial agora toda quarta e 12! (19/09, 26/09 e 03/10), chamar os amigos, vizinhos, colegas, conhecidos, crushes e vamos todos juntos mudar o brasil com #ciro12!"	4624	9	893
1216504185136925_1841003996020271	2018-09-18T04:36:44+0000	"#jornaldaglobo #ciro12"	6510	6	1712
1216504185136925_1840974112689926	2018-09-18T04:15:44+0000	"#jornaldaglobo #ciro12"	1289	2	219
1216504185136925_1840968079357196	2018-09-18T04:12:42+0000	"#jornaldaglobo #ciro12"	1162	2	172
1216504185136925_1840964186024252	2018-09-18T04:10:43+0000	"#jornaldaglobo #ciro12"	3045	3	749
1216504185136925_1840696209384383	2018-09-17T23:02:16+0000	"a equipe do plano de governo #ciro12 convida a populacao a contribuir com sugestoes para mudar o brasil. e so chegar com suas ideias. vamos juntos! participe!  inscreva-se: https://www.eventbrite.com.br/e/equipeciro-ouve-ideias-para-mudar-o-brasil-registration-50368580781"	1113	2	128
1216504185136925_1840648676055803	2018-09-17T22:01:33+0000	"nesta quinta, tem ciro em mais um debate entre presidenciaveis. desta vez, o encontro sera organizado pela confederacao nacional de bispos do brasil (cnbb), com transmissao pela tv aparecida e tv cultura. convide seus amigos para assistir! #ciro12 #debatecnbb"	1979	1	522
1216504185136925_1840475506073120	2018-09-17T19:00:51+0000	"ciro responde as perguntas dos usuarios do twitter nesta quarta, em transmissao ao vivo pela rede social a partir das 20h. envie sua pergunta no twitter atraves da hashtag #pergunteaociro12. #ciro12"	1140	3	161
1216504185136925_974756342711862	2018-09-16T17:44:55+0000	"de todo o meu coracao, obrigado, sao paulo!  foi lindo de ver, emocionante. eu sou paulista, eu falo mano, eu quero ciro presidente esse ano!  "	8122	17	2814
1216504185136925_1838934206227250	2018-09-16T17:00:57+0000	"segunda-feira tem ciro na bancada do jornal da globo. convide seus amigos para assistir. #jornaldaglobo #ciro12 #falaciro12"	9031	6	3221
1216504185136925_1838865456234125	2018-09-16T16:01:21+0000	"sintonize em ciro! a semana comeca com nosso cirao sendo entrevistado pela radio bandeirantes. fique ligado e convide seus amigos para ouvir as ideias e propostas de ciro. #ciro12 #radiobandeirantes"	914	4	267
1216504185136925_1818234278290172	2018-09-16T10:02:06+0000	"everton mc, obrigado pela homenagem. vamos juntos!  #ciro12 #ciropresidente"	2967	5	1190
1216504185136925_661678717541616	2018-09-16T01:37:08+0000	"como ministro da integracao nacional do governo lula, ciro comecou a obra da transposicao do rio sao francisco, que leva agua para regioes secas do nordeste. hoje, faltam apenas 3% para concluir a obra. ciro ja garantiu que vai terminar, acabando com o sofrimento de cerca de 10 milhoes de nordestinos que sofrem com a seca e a falta de agua. saiba mais sobre essa e outras propostas de ciro acessando: www.cirogomes.com.br/. #ciro12 #ciropresidente"	14729	53	7340
1216504185136925_1017418058419296	2018-09-16T00:31:09+0000	"belem quer mudar! mude o brasil junto com ciro! e ciro presidente do brasil!! #ciro12 #ciropresidente"	3357	7	1150
1216504185136925_2088722244505608	2018-09-15T23:20:37+0000	"muitas mulheres estarao com a gente amanha na caminhada pela paz no ibirapuera, as 10h. venha de branco, traga uma rosa. vamos nos unir para mudar o brasil! #ciro12 #ciropresidente"	2394	5	567
1216504185136925_2092255370794097	2018-09-15T21:36:20+0000	"ja foram quatro capitais do norte, agora ciro chega a macapa. ao lado do candidato a governador waldez goes, ciro agradece a empolgacao da populacao macapaense e vibra junto. #ciro12 #ciropresidente"	4988	5	2166
1216504185136925_244765342907067	2018-09-15T18:28:31+0000	"acompanhado da nossa candidata ao senado, angela portela, falamos sobre o investimento que faremos aqui na regiao norte. e com infraestrutura que vamos fazer roraima crescer! vamos juntos! #ciro12"	1352	4	151
1216504185136925_1287714021370817	2018-09-15T15:47:20+0000	"ciro comecou, como ministro da integracao nacional do governo lula, a obra da transposicao do rio sao francisco, que leva agua para regioes secas do nordeste. hoje, faltam apenas 3% para concluir a obra e ciro ja garantiu que vai terminar. saiba mais sobre essa e outras propostas acessando: www.cirogomes.com.br. #ciro12 #ciropresidente"	2264	4	870
1216504185136925_1837227459731258	2018-09-15T12:06:19+0000	"inscreva-se no canal oficial de ciro no telegram e fique por dentro de informacoes, conteudos e materiais sobre ciro e a campanha. acesse e divulgue https://t.me/cirogomes."	2012	2	183
