post_id	date	message	num_likes	num_angry	num_shares
398845206932703_1118701868280363	2018-08-09T17:24:47+0000	"a poeta e slamer kimani deu a letra ontem no nosso programa bololo sobre o que significa o aborto para as mulheres negras e explica porque nao ficarao mais caladas, recatadas e nem silenciadas. parabens kimani, toda forca nessa luta, conte conosco! #bololo #boulosesonia"	93	4	11
398845206932703_1118467021637181	2018-08-09T13:21:27+0000	"#aovivo minha entrevista para a globo news."	1356	7	858
398845206932703_1117482281735655	2018-08-08T18:12:03+0000	"nos vamos retomar a esperanca nas pessoas e isso se faz com politica olho no olho, indo para as periferias e debatendo com as pessoas. foi isso que fizemos no ultimo boulos na area, em itaquera, zona leste de sao paulo. #vamossemmedo #boulosesonia #psol2018"	278	0	100
398845206932703_1117330178417532	2018-08-08T15:09:38+0000	"codigo e conhecimento e precisa ser aberto e enquanto governo nao faz sentido que seja diferente."	916	5	167
398845206932703_1116461491837734	2018-08-07T22:46:40+0000	"democracia 5.0: #aovivo minha entrevista sobre politica e governanca digital para o luciano huck no govtech."	2668	23	1511
398845206932703_1115373095279907	2018-08-07T01:15:41+0000	"#aovivo acompanhe minha entrevista para o programa voz ativa na rede minas."	805	6	758
398845206932703_1113962212087662	2018-08-05T19:39:37+0000	"#aovivo bate papo com o vereador de recife e candidato a deputado federal ivan moraes sobre nossas propostas para o brasil."	360	2	312
398845206932703_1113956985421518	2018-08-05T19:34:54+0000	"grande atividade hoje em itaquera com a turma toda! #boulosesonia"	402	1	145
398845206932703_1113692818781268	2018-08-05T15:09:10+0000	"a saude no brasil teve seus investimentos congelados por 20 anos. e necessario revogar a emenda constitucional 95 para que o funcionamento do sus e de todo nosso sistema publico de saude atenda a populacao com qualidade. e o que queremos para o brasil neste dia nacional da saude e todos os dias! confira o video que alguns profissionais da saude e apoiadores fizeram pra gente #dianacionaldasaude #vamossemmedo #boulosesonia"	141	0	60
398845206932703_1112949065522310	2018-08-05T00:11:12+0000	"hoje mais de 100 pontos realizaram acoes de mobilizacao pelo brasil. essa onda so esta comecando e vai crescer muito. vamos juntos!   acompanhe a cobertura completa nas redes do vamos: https://fb.com/vamoscomboulosesonia/ https://instagram.com/vamoscomboulosesonia  #odespertardaforca"	67	0	45
398845206932703_1112859858864564	2018-08-04T22:09:43+0000	"#aovivo no festival #odespertardaforca foram mais de 100 acoes de mobilizacao pelo brasil. um novo jeito de fazer politica!"	948	9	360
398845206932703_1110670072416876	2018-08-03T20:24:46+0000	"convencao nacional do psol confirmou nossa candidatura. vamos juntos despertar a esperanca. sem medo de mudar o brasil!  #vamossemmedo #boulosesonia #psol2018"	588	4	141
398845206932703_1110417682442115	2018-08-02T21:34:01+0000	"#aovivo corte das bolsas capes ameaca a educacao e a pesquisa no brasil."	2624	190	3805
398845206932703_1109928282491055	2018-08-02T13:00:30+0000	"da pra investir mais em saude e educacao e isso nos vamos fazer. #boulosnabandnews"	256	0	72
398845206932703_1109246239225926	2018-08-01T22:51:45+0000	"a mudanca no pais ocorre quando o povo se mobiliza."	527	0	275
398845206932703_1108860265931190	2018-08-01T16:01:43+0000	"rodando o brasil, apresentando nossas ideias, dialogando com o povo e mobilizando gente, assim foi a nossa pre-campanha em julho. so no ultimo mes eu e sonia bone guajajara circulamos por mais de mais de 20 cidades e 17 estados e e assim que vamos seguir, cortando trecho, batendo porta a porta e olhando no olho das pessoas. #vamossemmedo #boulosesonia #psol2018"	698	4	265
398845206932703_1108607055956511	2018-08-01T12:00:01+0000	"hoje a grande gaby amarantos faz aniversario e pra saudar essa artista incrivel, uma otima resposta dela no programa do porchat. parabens gaby, que voce continue trazendo luz para nossa cultura. #vamossemmedo #boulosesonia #psol2018"	1242	1	353
398845206932703_1107627499387800	2018-07-31T16:09:27+0000	"#aovivo coletiva de imprensa na associacao comercial do rio de janeiro."	998	8	459
398845206932703_1107503926066824	2018-07-31T14:38:21+0000	"#aovivo brasil em debate promovido pela associacao comercial do rio de janeiro."	417	7	235
398845206932703_1106610229489527	2018-07-30T21:07:27+0000	"#aovivo em frente a embraer para discutir com trabalhadora da empresa a absurda venda para a boeing."	495	7	392
398845206932703_1105777719572778	2018-07-30T18:36:04+0000	"nao se avanca em politicas sociais se nao for enfrentando os privilegios de quem tem mais. nossa candidatura tem lado e e o lado do povo!  #vamossemmedo #boulosesonia #psol2018"	222	0	54
398845206932703_1105609242922959	2018-07-30T01:44:10+0000	"chegou a hora da guerrilha audiovisual! voce, videomaker, editora ou editor, pode fazer a diferenca ao meu lado e da sonia guajajara nessa caminhada. inscreva-se agora! - bit.ly/vamosaudiovisual"	184	0	61
398845206932703_1105415316275685	2018-07-29T21:59:27+0000	"#aovivo ontem estive na flip debatendo o futuro da esquerda com fernando haddad. assista como foi."	925	10	486
398845206932703_1104422319708318	2018-07-29T18:00:01+0000	"o brasil e a 7a economia do mundo, o problema nao e dinheiro, o problema e a desigualdade. quem tem mais paga menos enquanto quem tem menos paga mais. #namidia #boulosesonia #psol2018"	2440	8	1362
398845206932703_1092054940945056	2018-07-29T14:00:02+0000	"\"o racismo no brasil nao e um comportamento. o racismo no brasil e estrutueral e institucional.\" falei com midiativistas na favela da mare, confira!  assista inteiro: http://bit.ly/2jzywcv #racismo #vamossemmedo #boulosesonia"	394	1	159
398845206932703_1104294723054411	2018-07-29T00:47:11+0000	"#aovivo direto do festival lula livre no rio de janeiro"	1103	5	583
398845206932703_1103673856449831	2018-07-28T15:00:01+0000	"nosso compromisso e com a defesa da democracia! #vamossemmedo #boulosesonia"	286	2	88
398845206932703_1103727846444432	2018-07-28T14:40:24+0000	"no dia do agricultor, relembro um trecho da minha entrevista para o canal rural e reforco meu compromisso com a reforma agraria e com a agricultura familiar, que produz 70% dos alimentos consumidos pela populacao brasileira. parabens as agricultoras e agricultores de todo o brasil! #reformaagraria #vamossemmedo #boulosesonia"	341	1	149
398845206932703_1102899989860551	2018-07-27T20:29:45+0000	"nos nao negociamos nossos principios!  #vamossemmedo #boulosesonia #psol2018"	554	1	152
398845206932703_1102689909881559	2018-07-27T16:37:51+0000	"#aovivo falo agora no congresso da abrasco para milhares de servidores da saude."	434	5	386
398845206932703_1097947703689113	2018-07-26T18:01:45+0000	"precisamos garantir que quem nao tem voz na politica brasileira, tenha voz e o nosso governo vai fazer isso.  #namidia #boulosesonia #psol2018 #vamossemmedo"	227	0	71
398845206932703_1100904020060148	2018-07-26T12:00:00+0000	"se o mercado quiser definir as condicoes pra governar o brasil, que eleja os seus representantes na bolsa de valores. enquanto existir democracia no brasil, e o povo que decide.  #vamossemmedo #boulosesonia #psol2018"	829	2	329
398845206932703_1100474480103102	2018-07-25T19:03:10+0000	"nossa campanha vai crescer brasil a fora despertando essa esperanca  #boulosesonia #psol2018 #vamossemmedo"	201	0	65
398845206932703_1099496406867576	2018-07-24T23:07:45+0000	"cultura no centro da roda. debate sobre #aovivo cultura em salvador, traga suas propostas!"	149	0	107
398845206932703_1099143193569564	2018-07-24T16:32:59+0000	"#aovivo no programa o povo na tv em campo grande (ms), de maior audiencia no estado."	534	4	302
398845206932703_1098955210255029	2018-07-24T13:39:22+0000	"#aovivo em entrevista para a cbn campo grande 93,7."	479	5	215
398845206932703_1098326910317859	2018-07-24T00:34:56+0000	"#aovivo debate sobre a democratizacao dos territorios e defesa da amazonia em rio branco (ac)."	350	0	147
398845206932703_1097949093688974	2018-07-23T17:06:52+0000	"precisamos enfrentar a farra da \"bolsa empresario\" nesse pais. e isso se faz acabando com as desoneracoes para os super ricos e cobrando imposto de quem mais tem. #reformatributaria #vamossemmedo #boulosesonia #psol2018"	822	2	343
398845206932703_1097174030433147	2018-07-23T02:04:14+0000	"#aovivo no programa hora do voto da tv gazeta."	1099	16	600
398845206932703_1097089243774959	2018-07-23T00:35:50+0000	"domingo de manha na praca do campo limpo, periferia sul de sao paulo, debatendo com centenas de pessoas. e possivel fazer diferente. eu acredito! #compartilhe #boulosnaarea"	582	4	248
398845206932703_1096962043787679	2018-07-22T22:07:04+0000	"a confirmacao da chapa guilherme boulos e sonia bone guajajara pelo psol 50 ontem segue repercutindo na imprensa. #namidia #boulosesonia"	187	0	65
398845206932703_1096853867131830	2018-07-22T19:32:18+0000	"conheca um pouco mais da minha historia. #vamoscomboulosesonia #psol2018"	4561	90	2568
398845206932703_1096401730510377	2018-07-22T12:26:02+0000	"cafe com boulos expresso! voce pergunta na hora e ele responde #aovivo"	897	53	441
398845206932703_1095886187228598	2018-07-22T00:43:39+0000	"jornal nacional repercute a confirmacao do psol 50 da nossa chapa a presidencia.  #namidia #boulosesonia #vamossemedo #psol2018"	1655	6	621
398845206932703_1908462835880029	2018-07-21T18:20:46+0000	"#aovivo convencao eleitoral do psol 50 confirma candidatura de guilherme boulos e sonia bone guajajara a presidencia!"	694	20	355
398845206932703_1892068207507844	2018-07-21T13:00:18+0000	"a legalizacao do aborto avancou na argentina, foi aprovada na camara dos deputados e segue em agosto para votacao no senado. o brasil pode e deve se inspirar nas argentinas, que tomaram as ruas com milhoes de mulheres para pautar o debate publico sobre o tema em todo pais. precisamos superar os tabus e garantir a vida das mulheres com o aborto legal, seguro e gratuito para todas. isso e uma questao de saude publica,  nao podemos mais ver mulheres morrendo todos os dias em decorrencia de procedimentos ilegais. #abortolegalja"	277	59	56
398845206932703_1094414817375735	2018-07-20T21:01:08+0000	"confira a integra da minha sabatina para o zero hora em porto alegre. #namidia"	1193	6	949
398845206932703_1094222880728262	2018-07-20T18:23:14+0000	"qual o projeto politico que o centrao defende pro brasil? nada! e so negocio. #boulosnabandnews"	2842	20	1752
398845206932703_1094207784063105	2018-07-20T17:35:03+0000	"#aovivo em entrevista para o canal rural no programa mercado & companhia. fomos la para defender reforma agraria, agroecologia e demarcacao das terras indigenas e quilombolas!"	374	2	344
398845206932703_1092986074185276	2018-07-19T18:12:23+0000	" atencao!   recado importante para quem quer colaborar com o nosso programa!  acesse agora: http://vamoscomboulosesonia.com.br/programa #vamossemmedo #boulosesonia #psol2018"	29	0	5
398845206932703_1091588460991704	2018-07-18T14:10:00+0000	"estive conversando com comunicadores e comunicadoras populares na comunidade da mare, no rio de janeiro, e um dos questionamentos foi sobre acesso a comunicacao e internet. confira um pouco como foi!  assista completo: http://bit.ly/2jzywcv #vamossemmedo #boulosesonia #psol2018"	59	0	18
398845206932703_1901579956568317	2018-07-17T18:00:01+0000	"hoje e o dia de protecao as florestas e quem manda o recado e sonia bone guajajara: e necessario, acima de tudo, entender as florestas como seres vivos e entidades portadoras de direitos, como cada um de nos. o avanco do agronegocio ignora esse carater das florestas. isso so nos reforca a importancia de seguir na luta e defender esses direitos! #diadafloresta #vamossemmedo #boulosesonia"	119	1	45
398845206932703_1090555431095007	2018-07-17T15:53:10+0000	"#aovivo agora entrevista para o sbt em florianopolis."	330	1	173
398845206932703_1089802014503682	2018-07-16T23:17:18+0000	"os caminhos da esquerda com o tarso genro na assembleia legislativa do rs.  #vamossemmedo #boulosesonia2018 #psol50"	340	0	195
398845206932703_1089793001171250	2018-07-16T23:07:21+0000	"os caminhos da esquerda com o tarso genro na assembleia legislativa do rs.  #vamossemmedo #boulosesonia2018 #psol50"	155	0	29
398845206932703_1089219621228588	2018-07-16T12:55:18+0000	"#aovivo cafe com boulos: dialogo sobre depressao e saude mental direto de porto alegre. acompanhe e participe!"	564	6	536
398845206932703_1088557941294756	2018-07-15T21:58:49+0000	"roda viva da laje - coletivos de comunicacao das favelas do rio de janeiro entrevistam boulos no complexo de favelas da mare. #boulosnalaje"	651	4	458
398845206932703_1087323034751580	2018-07-14T19:37:52+0000	"a juventude quer viver! debate sobre as propostas para a juventude da pre-campanha de guilherme boulos e sonia guajajara. #aovivo"	104	0	22
398845206932703_1087232911427259	2018-07-14T18:28:34+0000	"a juventude quer viver! debate sobre as propostas para a juventude da pre-campanha de guilherme boulos e sonia guajajara. #aovivo"	220	1	119
398845206932703_1086846304799253	2018-07-14T12:33:00+0000	"cafe com boulos essa semana na raizes do brasil, casa do movimento dos pequenos agricultores. #aovivo"	686	10	454
398845206932703_1086813574802526	2018-07-14T12:17:02+0000	"conhecendo o raizes do brasil rj, casa do mpa - movimento dos pequenos agricultores. #aovivo"	314	4	117
398845206932703_1086284244855459	2018-07-13T22:50:16+0000	"#aovivo em debate com glauber braga em nova friburgo. #vamossemmedo #boulosesonia #psol2018"	431	5	193
398845206932703_1895455360514110	2018-07-13T18:40:34+0000	"agora voce ja pode contribuir com as propostas que eu e sonia bone guajajara defenderemos nessas eleicoes!    entre no nosso site: vamoscomboulosesonia.com.br/ interaja com as propostas e deixe suas sugestoes! nossa forma de fazer politica e assim, aberta, colaborativa e transparente. faca parte voce tambem!  #vamossemmedo #boulosesonia #psol2018"	77	1	16
398845206932703_1084938161656734	2018-07-12T18:26:46+0000	"tem gente no judiciario que se acha deus... #boulosnabandeirantes"	90	2	12
398845206932703_1084903108326906	2018-07-12T17:24:23+0000	"hoje, 120 dias sem marielle, vamos todas e todos 17h na candelaria para exigir justica por marielle e anderson.  #mariellevive #mariellepresente"	272	0	212
398845206932703_1084699661680584	2018-07-12T14:15:00+0000	"hoje tarcisio motta tem uma tarefa importantissima no rio de janeiro, vamos cassar o mandato de crivella e impedir os abusos que ele tem cometido na prefeitura utilizando verba e instrumentos publicos para privilegiar um pequeno grupo de pessoas, enquanto o restante da populacao sofre com o desmonte dos servicos basicos. #foracrivella"	345	1	75
398845206932703_1084664248350792	2018-07-12T14:00:01+0000	"e possivel se governar de outro jeito e vamos fazer isso colocando o poder na mao das pessoas.  #vamossemmedo #boulosesonia #boulosnabandeirantes"	78	0	33
398845206932703_1084687775015106	2018-07-12T13:48:40+0000	"#aovivo debato agora \"a crise de hoje e o futuro do brasil\" na escola politecnica da fiocruz no rio de janeiro"	435	8	197
398845206932703_1083909845092899	2018-07-11T21:17:07+0000	"#aovivo em entrevista para a radio bandeirantes no programa bastidores do poder. #boulosnaradiobandeirantes"	285	2	223
398845206932703_1083773741773176	2018-07-11T18:18:34+0000	"apos 5 anos de resistencia, mais de 900 familias agora tem seu sonho da casa propria alcancado gracas a muita determinacao, fe, luta e coragem. os apartamentos foram construidos pelos e para os sem teto do mtst - movimento dos trabalhadores sem-teto e o resultado sao apartamentos e condominios com elevador, quadra, parquinho, churrasqueira. hoje, somos o exemplo de que o pais tem jeito!  com muita gente junta podemos transformar o brasil. vamos juntos, eu acredito! #vamossemmedo #boulosesonia #psol2018"	644	2	550
398845206932703_1080521892098361	2018-07-08T20:21:22+0000	"agora em curitiba, na frente da pf, esperando a soltura de lula! #lulalivre"	3771	89	1717
398845206932703_1080237785460105	2018-07-08T16:30:42+0000	"o que a pf esta esperando para soltar lula? #lulalivre"	4115	177	3417
398845206932703_1080180178799199	2018-07-08T15:55:26+0000	"exigimos a libertacao imediata de lula! #lulalivre"	3602	95	2441
398845206932703_1079083115575572	2018-07-07T18:43:27+0000	"e hora de vencer o desemprego! acompanhe #aovivo o debate  das nossas propostas para o trabalho."	227	4	94
398845206932703_1078860615597822	2018-07-07T14:11:00+0000	"foi com muita emocao e satisfacao que entreguei ontem as chaves dos apartamentos dos condominios santo dias e novo pinheirinhos em santo andre para os lutadores e lutadoras do mtst - movimento dos trabalhadores sem-teto. apos 5 anos de resistencia, mais de 900 familias agora tem seu sonho da casa propria alcancado gracas a muita determinacao, fe, luta e coragem. a chave que receberam ontem simboliza tambem o poder nas nossas maos. disse e repito a todas e todos sempre, nunca deixem ninguem dizer que deram isso a voces, este sonho nos conquistamos juntos! e podemos conquistar muitos mais.  os apartamentos foram construidos pelos e para os sem teto num processo inovador de politica publica onde o movimento acompanhou e participou ativamente de todo o processo de construcao, inclusive colocando a mao na massa. o resultado sao apartamentos e condominio com elevador, quadra, churrasqueira, tudo com muita qualidade para garantir o bem estar e a qualidade de vida.   o sonho se alcanca quando se luta, somos o exemplo de que o pais tem jeito. com muita gente junta podemos transformar o brasil. eu acredito! vamos juntos!  fotos: midia ninja #vamossemmedo #boulosesonia #psol2018 #mtst #soalutamudaavida"	89	0	28
398845206932703_1078847132265837	2018-07-07T13:51:54+0000	"soberania e solidariedade entre os povos - #aovivo debate sobre as propostas para o programa de guilherme boulos e sonia bone guajajara"	280	2	263
398845206932703_1077728399044377	2018-07-06T10:51:08+0000	"boulos, pre-candidato a presidente do brasil, joga a realidade sem medo em campina grande! entrevista para a radio 101.1 fm. assista!!!"	612	15	266
398845206932703_1077164249100792	2018-07-05T23:41:29+0000	"a juventude precisa viver e a juventude tambem precisa trabalhar. o setimo episodio da serie desigualdade no pais dos privilegios aborda as nossas propostas para juventude e trabalho.  assista a mais um episodio da nossa serie e encaminhe perguntas e comentarios pela #eaiboulos?. vamos pensar juntos o que esse pais pode ser.  #juventude #fimdosprivilegios #vamossemmedo #boulosesonia #psol2018"	347	8	233
398845206932703_1077262239090993	2018-07-05T23:32:40+0000	"diversidade importa! sonia bone guajajara participa agora do debate de construcao das propostas lgbts que irao constar no nosso programa. #aovivo"	121	0	60
398845206932703_1076985739118643	2018-07-05T17:44:20+0000	"confira como foi minha entrevista hoje para a arapuan fm em joao pessoa, paraiba."	228	2	124
398845206932703_1076940222456528	2018-07-05T17:00:01+0000	"e hora de colocar a mao na massa junto com a gente! os grupos de acao do vamos e uma das formas como voce pode colaborar. cadastre-se na plataforma, monte seu grupo, inclua o numero da mobilizacao da campanha e dai e so correr pro abraco.  participe: http://vamoscomboulosesonia.com.br  #vamossemmedo #boulosesonia #psol2018"	27	0	6
398845206932703_1076305822519968	2018-07-05T16:00:00+0000	"disse tudopreta gil! o aborto nao e questao de querer, e garantir direito a vida, e uma questao de saude que deve ser debatida sem tabus. #epelavidadasmulheres #vamossemmedo #boulosesonia #psol2018 #descriminalizacaodoaborto video quebrando o tabu"	1223	31	220
398845206932703_1076767989140418	2018-07-05T13:39:15+0000	"a nossa passagem por natal foi excelente! encontramos com os apoiadores e apoiadoras da nossa pre-campanha e apresentamos nossas propostas para o brasil. confira um pouco do que foi no video feito pelo davi selton que acompanhou nossa agenda. #vamossemmedo #boulosesonia #psol2018"	104	0	71
398845206932703_1075921059225111	2018-07-04T18:49:37+0000	"a nossa alianca e com o povo. a gente nao abre mao dos nossos principios. #coerenia #vamossemmedo #boulosesonia #psol2018"	307	0	190
398845206932703_1075805079236709	2018-07-04T17:01:38+0000	"#aovivo entrevista para tv ponta negra no rio grande do norte."	605	6	336
398845206932703_1075692639247953	2018-07-04T15:19:09+0000	"#aovivo na radio 98 fm de natal."	316	1	242
398845206932703_1070533796430504	2018-07-04T13:00:01+0000	"otimo video do porta dos fundos. o parto humanizado e o atendimento digno as gestantes no sus deve ser obrigatorio! nao da pra ficarmos nas maos de planos de saude que so querem o lucro. saude nao e mercadoria. #vamossemmedo #boulosesonia #psol2018"	1140	6	458
398845206932703_1075215345962349	2018-07-04T12:00:01+0000	"e possivel, basta acreditar!  nessa sexta o mtst fara o ato da vitoria junto as familias de santo andre para comemorar o inicio da construcao dos condominios pinheirinho e santo dias, conquistados com muita luta pelos sem teto. teve sofrimento, angustia e ate desanimos, mas acreditamos juntos e agora e a hora de colher os frutos. no video, um pouco da historia de quem ja conseguiu sua casa no condominio joao candido, em taboao da serra. #vamossemmedo #boulosesonia #psol2018"	98	0	37
398845206932703_1073705362780014	2018-07-02T22:22:06+0000	"nosso compromisso e para que maes como dona edna nao tenham de passar por essa dor novamente.  #vamossemmedo #boulosesonia #psol2018"	50	0	40
398845206932703_1073334356150448	2018-07-02T12:57:23+0000	"aovivo na caminhada da independencia em salvador."	597	1	256
398845206932703_1072546416229242	2018-07-01T21:58:52+0000	"e possivel fazer de outro jeito! existem modelos mais sustentaveis e viaveis para viver.  em sao carlos eu e celio turino visitamos um exemplo de uma casa e sede da associacao veracidade com sistema de permacultura e agroecologia funcionando, com energia solar, captacao de agua de chuva, agrofloresta, compostagem e muito mais, comandado por djalma nery, que tambem e pre-candidato a deputado estadual pelo psol 50 em sao paulo.  #vamossemmedo #boulosesonia #psol2018"	433	0	305
398845206932703_1070477389769478	2018-07-01T13:00:01+0000	"nos ultimos dias a lamentavel politica para imigrantes dos eua foi assunto no mundo inteiro. nosso compromisso da pre-candidatura e promover os direitos humanos de todos os migrantes, fiscalizando e impedindo o trabalho escravo ou semi-escravo, incluindo a sua nao criminalizacao e trabalhando pela integracao social por meio da regularizacao migratoria e do amplo acesso a direitos. video: quebrando o tabu"	713	0	338
398845206932703_1071528742997676	2018-06-30T21:19:42+0000	"empurrando o brasil pra frente, vamos juntos! "	380	1	54
398845206932703_1071342459682971	2018-06-30T18:03:05+0000	"vamos combater as desigualdades - debate sobre assistencia social em recife, participe e envie suas propostas!"	288	2	221
398845206932703_1070359469781270	2018-06-29T19:36:51+0000	"ao vivo no forum do distrito federal saindo da audiencia contra o senador medeiros por fake news. a mentira nao passara!"	471	2	123
398845206932703_1060750117408872	2018-06-29T19:00:01+0000	"precisamos tirar o brasil dessa crise e pra isso e preciso ousadia, nao da pra ser com lenga lenga."	247	0	113
398845206932703_1070190956464788	2018-06-29T16:43:41+0000	"#aovivo em entrevista para o metropoles"	417	2	329
398845206932703_1070070379810179	2018-06-29T16:42:25+0000	"e hora de colocar a mao na massa!  os grupos de acao do vamos e uma das formas como voce pode colaborar. cadatre-se na plataforma, monte seu grupo, inclua o numero da mobilizacao da campanha e dai e so correr pro abraco.   participe: http://vamoscomboulosesonia.com.br  #vamossemmedo #boulosesonia #psol2018"	31	0	15
398845206932703_1070047893145761	2018-06-29T14:10:25+0000	"ontem em fortaleza me encontrei com lutadoras e lutadores do mtst - movimento dos trabalhadores sem-teto que acabaram de consquistar casa para 288 familias. a luta, a solidariedade e a garra dessas pessoas nos inspira a seguir em frente. vamos juntos! #vamossemmedo #boulosesonia #psol2018"	77	1	45
398845206932703_1069538779863339	2018-06-29T13:00:02+0000	"hoje eu quero falar com voces sobre um tema que causa incertezas e cada vez mais inquieta a muitas brasileiras e brasileiros: trabalho.   assista a mais um episodio da nossa serie \"desigualdade no pais dos privilegios\" e encaminhe perguntas e comentarios pela #eaiboulos?. vamos pensar juntos o que esse pais pode ser. #trabalho #fimdosprivilegios #vamossemmedo #boulosesonia #psol2018"	180	3	204
398845206932703_1069109356572948	2018-06-28T17:31:24+0000	"#aovivo conversando com adelita direto de fortaleza."	485	2	238
398845206932703_1068863836597500	2018-06-28T13:11:16+0000	"no dia do orgulho lgbt, a louie ponto explica bem os rotulos das comunidades lgbts. #orgulholgbt #vamossemmedo #boulosesonia"	429	0	148
398845206932703_1068803233270227	2018-06-28T12:11:34+0000	"#aovivo participo agora de entrevista ao vivo para a radio o povo em fortaleza."	445	2	211
398845206932703_1067044573446093	2018-06-26T19:26:35+0000	"boris casoy tendo que falar das nossas propostas na tv nao tem preco. #namidia #vamossemmedo #boulossemmedo #boulosesonia"	1038	1	288
398845206932703_1066764450140772	2018-06-26T14:26:39+0000	"#aovivo em entrevista no tutameia com eleonora de lucena e rodolfo lucena."	487	4	361
398845206932703_1065997203550830	2018-06-25T19:48:33+0000	"\"temos que levar as qualidades urbanas de infra-estrutura para as regioes perifericas, mas tambem levar a populacao mais pobre a morar nas regioes centrais.\" confira parte da entrevista que dei hoje para redetv sobre nossos projetos para presidencia do brasil. #boulosesonia #psol2018 #namidia #boulosnaredetv"	184	0	79
398845206932703_1065853956898488	2018-06-25T17:53:58+0000	"#aovivo em entrevista na redetv!"	544	3	447
